id,question,options,answer,notes,Tags,questionPre
220102040,红字更正法通常适用的情况有{{c1::}}。,记账后发现会计科目无误而所记金额大于应记金额<br>||记账后在当年内发现记账凭证所记的会计科目错误<br>||发现上一年度的记账凭证所记的会计科目错误<br>||记账后发现会计科目无误而所记金额小于应记金额<br>,1||2,参考解析：选项C，应用蓝字填写一张更正的记账凭证；选项D，应采用补充登记法。<br>,会计基础,
220102041,以下关于定期清查和不定期清查表述正确的有{{c1::}}。,定期清查可以是全面清查也可以是局部清查<br>||不定期清查可以是全面清查也可以是局部清查<br>||定期清查目的在于查明情况，分清责任<br>||不定期清查的目的在于保证会计核算资料的真实正确<br>,1||2,参考解析：选项C，定期清查目的在于保证会计核算资料的真实正确；选项D，不定期清查的目的在于查明情况，分清责任。<br>,会计基础,
220102042,下列各项中，属于原始凭证的有{{c1::}}。,盘存单<br>||库存现金盘点报告表<br>||银行对账单<br>||银行存款余额调节表<br>,1||2,参考解析：选项CD，均不属于原始凭证。<br>,会计基础,
220102043,下列对账工作中，属于账账核对的有{{c1::}}。,银行存款日记账与银行对账单的核对<br>||总账账户与所属明细账户的核对<br>||应收款项明细账与债务人账项的核对<br>||会计部门的财产物资明细账与财产物资保管、使用部门明细账的核对<br>,2||4,参考解析：选项AC，属于账实核对。<br>,会计基础,
220102044,下列关于财产清查方法的表述，正确的有{{c1::}}。,银行存款的清查采用和银行对账单核对的方法<br>||应收账款的清查采用发函询证的方法<br>||库存现金的清查采用实地盘点法<br>||成堆、量大且价值不高，逐一清点的工作量和难度较大的实物资产应采用技术推算法<br>,1||2||3||4,参考解析：银行存款的清查是将企业银行存款日记账与开户银行的对账单进行核对，选项A正确；往来款项的清查一般采用发函询证的方法，选项B正确；库存现金的清查是采用实地盘点法确定库存现金的实存数，与库存现金日记账的账面余额相核对，选项C正确；技术推算法只适用于成堆量大而价值不高，逐一清点的工作量和难度较大的财产物资的清查。例如，露天堆放的煤炭等，选项D正确。<br>,会计基础,
220102045,总账与明细账平行登记的要点包括{{c1::}}。,记账人员相同<br>||会计期间相同<br>||记账方向相同<br>||金额相同<br>,2||3||4,参考解析：总账与明细账平行登记的要点包括：方向相同、期间一致、金额相等。<br>,会计基础,
220102046,下列各项中，关于财产清查的相关表述正确的有{{c1::}}。,往来款项清查一般采用发函询证的方法<br>||库存现金清查采用实地盘点法<br>||银行存款清查采用与开户行核对账目的方法<br>||实物资产清查只能采用实地盘点法<br>,1||2||3,参考解析：选项D，实物资产的清查方法主要有实地盘点法和技术推算法，并不是所有的实物资产都能用实地盘点法进行清查。<br>,会计基础,
220102047,下列会计科目中，属于负债类科目的有{{c1::}}。,长期借款<br>||应交税费<br>||累计折旧<br>||应付利息<br>,1||2||4,参考解析：选项C，“累计折旧”是固定资产的备抵科目，属于资产类科目。<br>,会计基础,
220102048,下列有关账户和会计科目关系的表述正确的有{{c1::}}。,两者核算内容一致，性质相同<br>||会计科目是设置账户的依据<br>||账户具有一定的格式结构，而会计科目没有<br>||没有账户，会计科目就无法发挥作用<br>,1||2||3||4,参考解析：会计科目与账户两者核算内容一致，性质相同；会计科目是账户的名称，也是设置账户的依据；会计科目的性质决定了账户的性质，会计科目的分类决定了账户的分类。没有会计科目，账户便失去了设置的依据；没有账户，会计科目就无法发挥作用。会计科目仅仅是账户的名称，不存在结构，而账户则具有一定的格式和结构。<br>,会计基础,
220102049,通过试算平衡，可以检查出的错误有{{c1::}}。,漏登或重登了借方金额或贷方金额<br>||登错了借方金额或贷方金额<br>||将借方金额登到了贷方<br>||漏登或重登了一笔业务<br>,1||2||3,参考解析：选项D，漏登或重登某项经济业务不会影响借贷双方的平衡关系，所以不能通过试算平衡检查出该类错误。<br>,会计基础,
220102050,记账后发现记账凭证中应借、应贷会计科目正确，只是金额发生错误，可能采用的错账更正方法有{{c1::}}。,划线更正法<br>||横线登记法<br>||红字更正法<br>||补充登记法<br>,3||4,参考解析：记账后如果记账凭证中应借、应贷会计科目正确，如果所记金额大于应记金额，采用红字更正法；如果所记金额小于应记金额，采用补充登记法。<br>,会计基础,
220102051,下列各项中，属于单位应用管理会计时采用的工具方法有{{c1::}}。,战略地图<br>||平衡计分卡<br>||作业成本法<br>||滚动预算<br>,1||2||3||4,参考解析：管理会计工具方法包括战略地图、滚动预算、作业成本法、本量利分析、平衡计分卡等。<br>,会计基础,
220102052,下列有关管理会计指引体系的表述，正确的有{{c1::}}。,基本指引在指引体系中起统领作用，是制定应用指引和建设案例库的基础<br>||基本指引既对管理会计普遍规律和基本认识进行总结升华，也对应用指引中未做出描述的新问题提供处理依据<br>||应用指引居于主体地位，是对单位管理会计工作的具体指导<br>||建立管理会计案例库，是管理会计体系建设区别于企业会计准则体系建设的一大特色<br>,,,,
220102053,下列有关管理会计指引体系的表述，正确的有{{c1::}}。,多项选择题<br>52/ 69<br>||基本指引在指引体系中起统领作用，是制定应用指引和建设案例库的基础<br>||基本指引既对管理会计普遍规律和基本认识进行总结升华，也对应用指引中未做出描述的新问题提供处理依据<br>||应用指引居于主体地位，是对单位管理会计工作的具体指导<br>||建立管理会计案例库，是管理会计体系建设区别于企业会计准则体系建设的一大特色<br>,1||3||4,"参考解析：选项B,基本指引并未对应用指引中未做出描述的新问题提供处理依据。<br>",会计基础,
220102054,下列各项中，适宜采用分批法计算产品成本的有{{c1::}}。,造船<br>||冶金<br>||采掘<br>||新产品试制<br>,1||4,参考解析：选项B，适宜采用分步法；选项C，适宜采用品种法。<br>,会计基础,
220102055,下列各项中，关于品种法的表述正确的有{{c1::}}。,成本核算对象是产品品种<br>||成本计算期与产品生产周期基本一致<br>||单步骤大量生产的企业适宜采用品种法核算产品成本<br>||期末在产品数量较多时，要将生产成本在完工产品和在产品之间进行分配<br>,1||3||4,参考解析：选项B，属于分批法的特点。<br>,会计基础,
220102056,下列关于政府会计核算说法正确的有{{c1::}}。,预算会计反映和监督预算收支执行情况<br>||政府会计主体应当编制决算报告和财务报告<br>||政府财务会计要素包括资产、负债、所有者权益、收入、费用和利润<br>||政府决算报告的编制主要以收付实现制为基础<br>,1||2||4,参考解析：选项C，政府财务会计要素包括资产、负债、净资产、收入和费用。<br>,会计基础,
220102057,下列各项中，属于政府会计要素负债计量属性的有{{c1::}}。,现值<br>||公允价值<br>||名义金额<br>||历史成本<br>,1||2||4,参考解析：选项C，属于政府会计资产的计量属性。<br>,会计基础,
220102058,企业接受的捐赠应计入当期的收入。{{c1::}},对<br>||错<br>,2,参考解析：企业接受的捐赠属于非日常活动中形成的，应计入营业外收入，属于利得。<br>,会计基础,
220102059,我国《企业会计准则》将会计要素划分为资产、负债、所有者权益、成本和利润五大类。{{c1::}},对<br>||错<br>,2,参考解析：我国《企业会计准则》将会计要素划分为资产、负债、所有者权益、收入、费用和利润六大类。<br>,会计基础,
220102060,为了全面、序时、连续、系统地反映和监督会计要素的增减变动，必须设置账户。{{c1::}},对<br>||错<br>,1,参考解析：<br>,会计基础,
220102061,发现以前年度记账凭证是错误的，应当用红字填制一张更正的记账凭证。{{c1::}},对<br>||错<br>,2,参考解析：<br>,会计基础,
220102062,汇总记账凭证账务处理程序既能保持账户的对应关系，又能减轻登记总分类账的工作量。{{c1::}},对<br>||错<br>,1,参考解析：<br>,会计基础,
220102063,所有的记账凭证都必须附有原始凭证，否则，不能作为记账的依据。{{c1::}},对<br>||错<br>,2,参考解析：结账和更正错账的记账凭证可以不附原始凭证。<br>,会计基础,
220102064,在登记各种账簿时，可以根据需要隔页、跳行。{{c1::}},对<br>||错<br>,2,参考解析：会计账簿应当按照连续编号的页码顺序登记，不得隔页、跳行。<br>,会计基础,
220102065,在结账前，企业会计人员发现账簿记录有文字错误，而记账凭证没有错误，应当采用划线更正法进行更正。{{c1::}},对<br>||错<br>,1,参考解析：在结账前发现账簿记录有文字或数字错误，而记账凭证没有错误，应当采用划线更正法。<br>,会计基础,
220102066,经济业务的发生，可能引起资产与权益总额发生变化，但是不会破坏基本会计等式的平衡关系。{{c1::}},对<br>||错<br>,1,参考解析：<br>,会计基础,
220102067,账户的结构分为左右两方，其中左方表示增加，右方表示减少。{{c1::}},对<br>||错<br>,2,参考解析：账户的哪方表示增加，哪方表示减少，要根据所记录的经济业务和账户的性质来确定。<br>,会计基础,
220102068,库存现金日记账是由出纳人员根据审核无误的现金收、付款凭证和转账凭证按照经济业务的发生顺序，逐日、逐笔序时登记。{{c1::}},对<br>||错<br>,2,参考解析：转账凭证不是库存现金日记账的登记依据。<br>,会计基础,
220102069,管理会计报告是管理会计活动成果的重要表现形式。{{c1::}},对<br>||错<br>,1,参考解析：<br>,会计基础,
220103001,企业现金清查中，经检查仍无法查明原因的现金溢余，经批准后应记入的科目是{{c1::}}。,其他业务收入<br>||营业外收入<br>||管理费用<br>||营业外支出<br>,2,参考解析：企业现金清查中，对于无法查明原因的现金溢余，计入营业外收入。<br>,流动资产,
220103002,下列各项中，企业不通过“其他货币资金”科目核算的是{{c1::}}。,用银行本票支付采购办公用品的款项<br>||存入证券公司指定账户的款项<br>||销售商品收到的商业汇票<br>||存入银行信用证保证金专户的款项<br>,3,参考解析：选项C，销售商品收到的商业汇票应通过“应收票据”核算。<br>,流动资产,
220103003,下列各项中，应记入“应收票据”科目借方的是{{c1::}}。,提供服务收到的银行承兑汇票<br>||提供服务收到的银行本票<br>||销售商品收到的银行汇票<br>||销售原材料收到的转账支票<br>,1,参考解析：选项BCD，应记入“银行存款”科目的借方。<br>,流动资产,
220103004,下列各项中，属于“其他应收款”科目核算内容的是{{c1::}}。,为职工垫付的房租<br>||为购货单位垫付的运费<br>||应收的销售材料款<br>||债券投资应收的利息<br>,1,参考解析：选项BC，通过“应收账款”科目核算；选项D，通过“应收利息”科目核算。<br>,流动资产,
220103005,2020年12月1日，某企业“坏账准备——应收账款”科目贷方余额为2万元。12月25日，收回已作坏账转销的应收账款3万元；12月31日，应收账款余额为300万元，经减值测试，应收账款的预计未来现金流量现值为260万元。不考虑其他因素，12月31日该企业应计提的坏账准备金额为{{c1::}}万元。,35<br>||40<br>||45<br>||37<br>,1,参考解析：12月25日收回已作坏账转销的应收账款：<br>借：应收账款3<br>贷：坏账准备3<br>借：银行存款3<br>贷：应收账款3<br>12月31日，应收账款发生减值，坏账准备应有余额＝300－260＝40（万元）。<br>12月31日，应计提的坏账准备＝40－2－3＝35（万元）。<br>,流动资产,
220103006,2019年12月初，某企业“应收账款”科目借方余额为600万元，相应的“坏账准备”科目贷方余额为40万元，本月实际发生坏账损失12万元。2019年12月31日该企业应补提坏账准备22万元。不考虑其他因素，该企业2019年12月31日“坏账准备”的期末余额为{{c1::}}万元。,50<br>||22<br>||62<br>||40<br>,1,参考解析：期末，坏账准备的应有余额＝40－12＋22＝50（万元）。<br>,流动资产,
220103007,下列各项中，应记入“坏账准备”科目借方的是{{c1::}}。,企业实际发生坏账<br>||收回过去已确认并转销的坏账<br>||期末“坏账准备”的应有余额大于计提前坏账准备的已有余额<br>||企业对当期增加的某项应收账款计提坏账准备<br>,1,参考解析：选项BCD，均记入“坏账准备”科目的贷方。<br>选项A，<br>借：坏账准备<br>贷：应收账款<br>选项B，<br>借：应收账款<br>贷：坏账准备<br>借：银行存款<br>贷：应收账款<br>选项C，<br>借：信用减值损失<br>贷：坏账准备<br>选项D，<br>借：信用减值损失<br>贷：坏账准备<br>,流动资产,
220103008,2017年某小企业向甲公司销售一批产品，货款合计50000元，因甲公司财务状况原因导致长期未能收回。2022年经过催收，甲公司支付了12000元，剩余款项确实无法收回确认为坏账。不考虑其他因素，该小企业2022年应确认坏账损失的金额为{{c1::}}元。,12000<br>||50000<br>||38000<br>||0<br>,3,参考解析：应确认坏账损失的金额＝50000－12000＝38000（元），会计分录为：<br>借：银行存款12000<br>营业外支出——坏账损失38000<br>贷：应收账款50000<br>,流动资产,
220103009,甲公司为增值税一般纳税人，购入乙上市公司股票，共支付价款400万元（其中包含已宣告但尚未发放的现金股利12万元），另支付相关交易费用1万元、增值税0.06万元，已取得增值税专用发票，全部款项已经支付。购入股票通过“交易性金融资产”科目核算。不考虑其他因素，下列各项中，该交易性金融资产的入账金额为{{c1::}}万元。,400<br>||401.06<br>||388<br>||389<br>,3,参考解析：交易性金融资产的入账金额＝400－12＝388（万元）。 会计分录为：<br>借：交易性金融资产——成本388<br>应收股利12<br>投资收益1<br>应交税费——应交增值税（进项税额）0.06<br>贷：其他货币资金401.06<br>,流动资产,
220103010,2019年3月1日，甲公司从二级市场购入乙公司发行的股票100万股并划分为交易性金融资产，每股价格10元，另支付交易费用1万元。乙公司于3月5日宣告按每股0.1元的比例分配现金股利，甲公司于3月10日收到现金股利10万元。3月20日，甲公司以每股11元的价格将股票全部出售，另支付交易费用1万元。2019年3月甲公司应确认的投资收益为{{c1::}}万元。,110<br>||109<br>||108<br>||98<br>,3,参考解析：2019年3月甲公司应确认的投资收益＝－1＋10＋（11×100－1－10×100）＝108（万元）。<br>,流动资产,
220103011,关于交易性金融资产的计量，下列说法中正确的是{{c1::}}。,取得交易性金融资产时，要按取得的公允价值和相关交易费用之和作为初始确认金额<br>||应当按取得该金融资产的公允价值作为初始确认金额，相关交易费用发生时计入投资收益<br>||资产负债表日，交易性金融资产的公允价值变动计入当期所有者权益<br>||处置交易性金融资产时，出售价款与初始确认金额之间的差额应确认为投资收益<br>,2,参考解析：选项A，对于交易性金融资产，应当按照取得时的公允价值作为初始确认金额，相关的交易费用在发生时计入投资收益；选项C，资产负债表日，企业应将交易性金融资产的公允价值变动计入公允价值变动损益；选项D，处置交易性金融资产时，出售价款与账面价值之间的差额应确认为投资收益。<br>,流动资产,
220103012,2019年3月2日，甲公司以银行存款购入A上市公司股票100万股，每股8元，另发生交易费用2万元，并将该股票划分为交易性金融资产。3月31日，该股票在证券交易所的收盘价为每股7.7元。4月30日，该股票在证券交易所的收盘价为每股8.1元。5月10日，甲公司将所持有的该股票全部出售，所得价款825万元。则该交易性金融资产对甲公司2019年度的利润影响金额为{{c1::}}万元。,15<br>||25<br>||23<br>||13<br>,3,参考解析：购入时，支付的交易费用计入投资收益的借方金额为2万元；3月31日公允价值变动计入公允价值变动损益的借方，金额为30万元（770－800）；4月30日公允价值变动计入公允价值变动损益的贷方，金额为40万元（810－770）；处置时计入投资收益贷方的金额为15万元（825－810）；所以对利润影响的金额＝－2－30＋40＋15＝23（万元）。<br>,流动资产,
220103013,2018年10月1日，A公司购入B公司股票50000股，每股买价8元，划分为交易性金融资产。支付价款中包含已宣告但尚未发放的现金股利每股1元。另支付相关交易费用4000元。10月5日收到B公司发放的现金股利。12月3日，出售持有的B公司股票50000股，价款为每股11元。已知金融商品转让的增值税税率为6％，则应交增值税为{{c1::}}元。,33000<br>||8490.57<br>||11320.75<br>||31132.08<br>,2,参考解析：转让金融商品应交增值税＝（50000×11－50000×8）/（1＋6％）×6％＝8490.57（元）。<br>,流动资产,
220103014,2019年12月10日，某小企业购入A公司15万股股票作为短期投资，取得价款为90万元。2020年3月1日，A公司宣告发放现金股利3万元；3月15日收到A公司分派的现金股利。2020年6月30日，将该股票出售，股票的市价为每股6.5元。不考虑其他因素，2020年因该短期投资确认的投资收益为{{c1::}}万元。,7.5<br>||10.5<br>||4.5<br>||0<br>,2,参考解析：2019年12月10日：<br>借：短期投资90<br>贷：银行存款90<br>2020年3月1日：<br>借：应收股利3<br>贷：投资收益3<br>3月15日收到A公司分派的现金股利：<br>借：银行存款3<br>贷：应收股利3<br>2020年6月30日：<br>借：银行存款（6.5×15）97.5<br>贷：短期投资90<br>投资收益7.5<br>2020年因该短期投资确认的投资收益＝3＋7.5＝10.5（万元）。<br>,流动资产,
220103015,下列各项中，一般不计入存货成本的是{{c1::}}。,负担的运输费用<br>||支付的进口关税<br>||入库后的仓储费<br>||入库前整理挑选费<br>,3,参考解析：入库后的仓储费，一般应计入管理费用；若为生产过程中为达到下一个生产阶段所必需的仓储费用则应计入存货成本。<br>,流动资产,
220103016,某商业企业采用售价金额核算法计算期末存货成本。本月月初存货成本为30000元，售价总额为45000元；本月购入存货成本为150000元，相应的售价总额为180000元；本月销售收入为120000元。则该企业本月销售成本为{{c1::}}元。,98333<br>||60000<br>||96000<br>||36667<br>,3,参考解析：商品进销差价率＝（45000－30000＋180000－150000）/（45000＋180000）×100％＝20％，本月销售成本＝120000×（1－20％）＝96000（元）。<br>,流动资产,
220103017,A公司材料采用计划成本法核算。月初结存材料计划成本为200万元，材料成本差异为节约20万元，当月购入材料一批，实际成本为135万元，计划成本为150万元，领用材料的计划成本为180万元。则领用材料的实际成本为{{c1::}}万元。,170<br>||162<br>||153<br>||187<br>,2,参考解析：材料成本差异率＝（月初材料成本差异＋本月购入材料的材料成本差异）/（月初材料计划成本＋本月购入材料计划成本）＝（－20－15）/（200＋150）×100％＝－10％，为节约差异。所以，领用材料实际成本＝180×（1－10％）＝162（万元）。<br>,流动资产,
220103018,某工业企业为增值税一般纳税人，适用的增值税税率为13％。采用月末一次加权平均法计算发出原材料的成本。2018年10月1日，甲材料结存200千克，每千克实际成本为200元，10月9日购入甲材料300千克，取得的增值税专用发票上注明的价款为65400元，增值税税额为8502元。材料入库前的挑选整理费为300元，材料已验收入库。10月25日发出甲材料400千克。则10月末甲材料的库存余额为{{c1::}}元。,21140<br>||25000<br>||21200<br>||29500<br>,1,参考解析：该材料的入账价值＝65400＋300＝65700（元），存货加权平均单价＝（200×200＋65700）/（200＋300）＝211.4（元）。月末库存材料的数量＝200＋300－400＝100（千克），所以甲材料的库存余额＝100×211.4＝21140（元）。<br>,流动资产,
220103019,A企业委托B企业（A、B企业均为增值税一般纳税人）加工应税消费品一批，发出材料成本为67.5万元，支付给B企业加工费4.5万元，由B企业代收代缴消费税8万元，材料已经加工完毕验收入库，收回后用于直接销售。该委托加工物资加工后的入库成本为{{c1::}}万元。,75<br>||72<br>||67.5<br>||80<br>,4,参考解析：委托加工物资收回后用于直接销售，由受托方代收代缴的消费税应计入委托加工物资成本。该委托加工物资加工后的入库成本＝67.5＋4.5＋8＝80（万元）。<br>,流动资产,
220103020,某企业采用先进先出法计算发出材料的成本。2020年3月1日结存A材料100吨，每吨实际成本为400元；4月4日和5月17日分别购进A材料300吨和400吨，每吨实际成本分别为350元和420元；4月10日和5月27日分别发出200吨A材料。则A材料5月末账面余额为{{c1::}}元。,30000<br>||25601<br>||178000<br>||168000<br>,4,参考解析：A材料的月末余额＝400×420＝168000（元）。<br>,流动资产,
220103021,某企业因自然灾害毁损材料一批，购进时支付价款16000元，增值税进项税额为2080元。应收保险公司赔款1500元，残料入库价值200元。不考虑其他因素，应计入营业外支出的金额为{{c1::}}元。,17020<br>||18620<br>||14300<br>||14400<br>,3,参考解析：自然灾害导致的存货盘亏，不需要将进项税额转出。本题分录为：<br>批准前：<br>借：待处理财产损溢16000<br>贷：原材料16000<br>批准后：<br>借：其他应收款1500<br>原材料200<br>营业外支出14300<br>贷：待处理财产损溢16000<br>故应记入“营业外支出”账户的金额＝16000－1500－200＝14300（元）。<br>,流动资产,
220103022,甲公司发出存货时采用先进先出法，2020年6月初库存商品M的账面余额为600万元，已提存货跌价准备60万元，本月购入M商品的成本为430万元，本月销售M商品结转成本500万元，期末结存存货的预计售价为520万元，预计销售税费为70万元，则当年年末应计提的存货跌价准备为{{c1::}}万元。,75<br>||71<br>||80<br>||70<br>,4,参考解析：①本月销售时应结转存货跌价准备的金额＝60×500/600＝50（万元）；②结转后存货跌价准备的余额＝60－50＝10（万元）；③期末存货的可变现净值＝520－70＝450（万元）；④期末存货的账面余额＝600＋430－500＝530（万元）；⑤期末存货跌价准备的应有余额＝530－450＝80（万元）；⑥期末存货应补提的跌价准备＝80－10＝70（万元）。<br>,流动资产,
220103023,下列关于低值易耗品的说法中，不正确的是{{c1::}}。,低值易耗品应通过“周转材料”科目核算<br>||低值易耗品符合存货定义和条件的，通常应当按照使用次数分次计入成本费用<br>||金额较小的低值易耗品，可在领用时一次性计入成本费用<br>||摊销低值易耗品的价值时，均应计入管理费用<br>,4,参考解析：摊销低值易耗品的价值时，应根据低值易耗品的具体用途确定应记入科目，如果是生产车间领用，一般应记入“制造费用”科目，如果是管理部门领用，一般应记入“管理费用”科目。<br>,流动资产,
