id,question,options,answer,notes,Tags,questionPre
220103024,A公司与B公司均为增值税一般纳税人，A公司委托B公司加工一批材料（属于应税消费品），收回后继续用于生产应税消费品，A公司发出原材料实际成本为100万元。加工完成后，A公司支付加工费20万元（不含增值税），并取得增值税专用发票，增值税税率为13％，消费税税率为10％。不考虑其他因素，A公司收回该批委托加工物资的入账价值为{{c1::}}万元。,116.85<br>||136.33<br>||120<br>||139.73<br>,3,参考解析：A公司为增值税一般纳税人并取得了增值税专用发票，因此增值税不应计入委托加工物资的成本；委托加工物资收回后继续用于生产应税消费品，所以消费税不应计入委托加工物资的成本。该批委托加工物资的入账价值＝100＋20＝120（万元）。<br>,流动资产,
220103025,某企业材料采用计划成本核算，月初结存材料计划成本为260万元，材料成本差异为节约60万元；当月购入材料一批，实际成本为150万元，计划成本为140万元，领用材料的计划成本为200万元。则当月结存材料的实际成本为{{c1::}}万元。,125<br>||200<br>||250<br>||175<br>,4,参考解析：材料成本差异率＝（－60＋10）/（260＋140）×100％＝－12.5％；当月领用材料的实际成本＝200×（1－12.5％）＝175（万元）；当月结存材料的实际成本＝260－60＋150－175＝175（万元）。<br>,流动资产,
220103026,某企业为增值税小规模纳税人，购入一批原材料。取得的增值税专用发票上注明的价款为100万元，增值税税额为13万元；另付运费1万元，取得的增值税专用发票上注明的增值税税额为0.09万元。不考虑其他因素，该批原材料入账成本为{{c1::}}万元。,114.09<br>||113<br>||114<br>||101<br>,1,参考解析：小规模纳税人核算增值税采用简化的方法，即购进货物、应税劳务或应税行为，取得增值税专用发票上注明的增值税，一律不予抵扣，直接计入相关成本费用或资产。则该批原材料入账价值＝100＋13＋1＋0.09＝114.09（万元）。<br>,流动资产,
220103027,某企业2018年12月31日存货的账面余额为20000元，预计可变现净值为19000元。2019年12月31日存货的账面余额仍为20000元，预计可变现净值为21000元。则2019年年末应转回的存货跌价准备为{{c1::}}元。,1000<br>||2000<br>||9000<br>||3000<br>,1,参考解析：当存货的账面余额低于其可变现净值时，只需将以前计提的存货跌价准备转回。<br>,流动资产,
220103028,某商品流通企业采用毛利率法计算发出存货成本。该企业2020年4月份实际毛利率为20％，本年度5月1日的存货成本为3000万元，5月份购入存货成本为2500万元，销售收入为3000万元，销售退回为500万元。则该企业5月末存货成本为{{c1::}}万元。,1300<br>||1900<br>||2110<br>||3500<br>,4,参考解析：5月销售毛利＝（3000－500）×20％＝500（万元）；5月销售成本＝（3000－500）－500＝2000（万元）；5月末存货成本＝3000＋2500－2000＝3500（万元）。<br>,流动资产,
220103029,下列关于小企业对存货的核算表述中，不正确的是{{c1::}}。,包装材料，应记入“原材料”科目<br>||用于存储而不对外销售的包装物，应记入“固定资产”或“原材料”科目<br>||盘盈存货，应冲减“管理费用”科目<br>||计划成本法下，可以在“周转材料”科目下设置“成本差异”明细来核算材料成本差异<br>,3,参考解析：选项C，应记入“营业外收入”科目。<br>,流动资产,
220103030,某企业采用托收承付结算方式销售一批商品，增值税专用发票上注明的价款为1000万元，增值税税额为130万元，销售商品为客户代垫运输费5万元，全部款项已办妥托收手续。则该企业应确认的应收账款为{{c1::}}万元。,1000<br>||1005<br>||1130<br>||1135<br>,4,参考解析：该企业应确认的应收账款＝1000＋130＋5＝1135（万元）。<br>,流动资产,
220103031,某企业为增值税小规模纳税人，本月购入甲材料2060千克，每千克单价50元（含增值税），另外支付运杂费3500元，运输途中发生合理损耗60千克，入库前发生挑选整理费620元。则该批材料的实际单位成本为{{c1::}}元。,50<br>||51.81<br>||52<br>||53.56<br>,4,参考解析：该批材料的实际单位成本＝（2060×50＋3500＋620）/（2060－60）＝53.56（元/千克）。<br>,流动资产,
220103032,某企业原材料按实际成本进行日常核算。2017年3月1日结存甲材料300千克，每千克实际成本为20元；3月15日购入甲材料280千克，每千克实际成本为25元；3月31日发出甲材料200千克（该批材料为3月15日购进的材料）。按个别计价法和先进先出法计算3月份发出甲材料的实际成本的差额为{{c1::}}元。,400<br>||500<br>||1000<br>||1400<br>,3,参考解析：个别计价法：发出材料的成本＝200×25（3月15日购入材料的单位成本）＝5000（元）；先进先出法：发出材料的成本＝200×20（3月1日结存材料的单位成本）＝4000(元)；两种方法下计算出的发出材料的实际成本的差额＝5000－4000＝1000（元）。<br>,流动资产,
220103033,5月1日，A公司甲材料结存300千克，单价2万元；5月6日发出100千克；5月10日购进200千克，单价2.2万元；5月15日发出200千克。企业采用移动加权平均法计算发出存货成本，则5月15日结存材料的成本为{{c1::}}万元。,400<br>||416<br>||420<br>||440<br>,3,参考解析：5月10日的材料平均单位成本＝（300×2－100×2＋200×2.2）/（300－100＋200）＝2.1（万元）；5月15日结存材料的成本＝（300－100＋200－200）×2.1＝420（万元）。<br>,流动资产,
220103034,企业销售产品领用不单独计价的包装物一批，其计划成本为10000元，材料成本差异率为3％。对于该项业务，下列处理中正确的是{{c1::}}。,应计入其他业务成本的金额为10300元<br>||应计入其他业务成本的金额为10000元<br>||应计入销售费用的金额为10000元<br>||应计入销售费用的金额为10300元<br>,4,参考解析：企业销售商品领用的不单独计价的包装物，应按实际成本计入销售费用，因此，计入销售费用的金额＝10000＋10000×3％＝10300（元）。<br>,流动资产,
220103035,2021年6月5日，甲公司委托某量具厂加工一批量具，发出材料的计划成本为80000元，材料成本差异率为5％，以银行存款支付运杂费2000元，6月25日以银行存款支付上述量具的加工费20000元，6月30日收回委托加工的量具，并以银行存款支付运杂费3000元。假定不考虑其他因素，甲公司收回该批量具的实际成本为{{c1::}}元。,102000<br>||105000<br>||103000<br>||109000<br>,4,参考解析：实际成本＝耗用材料的实际成本＋运杂费＋加工费＝（80000＋80000×5％）＋2000＋20000＋3000＝109000（元）。<br>,流动资产,
220103036,某企业原材料采用实际成本核算，2021年6月29日该企业对存货进行全面清查。发现短缺原材料一批，账面成本12000元，已计提存货跌价准备2000元。经确认，应由保险公司赔款4000元，由过失人员赔款3000元，假定不考虑相关税费等其他因素，该项存货清查业务应确认的净损失为{{c1::}}元。,3000<br>||5000<br>||6000<br>||8000<br>,1,参考解析：盘亏存货的净损失是盘亏存货的账面价值扣除应收赔偿款后的净额。所以，净损失＝12000－2000－4000－3000＝3000（元）。<br>,流动资产,
220103037,关于企业的现金管理，下列说法中正确的有{{c1::}}。,向个人收购农副产品或其他物资，超过30000元，就不能使用现金<br>||单位留存现金的最高数额为10000元<br>||出差人员必须随身携带的差旅费可以用现金支付<br>||1000元以下的办公用品购置费可以用现金支付<br>,3||4,参考解析：选项A，向个人收购农副产品和其他物资的价款可以用现金支付，没有金额限制；选项B，单位留存现金的限额是由开户银行根据单位实际需要核定的，一般按照单位3～5天日常零星开支所需确定。<br>,流动资产,
220103038,对于现金短缺，企业在进行会计处理时，可能涉及的科目有{{c1::}}。,管理费用<br>||其他应收款<br>||待处理财产损溢<br>||应收账款<br>,1||2||3,参考解析：现金短缺时的会计分录如下：<br>借：待处理财产损溢<br>贷：库存现金<br>借：其他应收款<br>管理费用<br>贷：待处理财产损溢<br>,流动资产,
220103039,下列各项中，属于企业金融资产的有{{c1::}}。,应收票据<br>||应收账款<br>||债券投资<br>||库存现金<br>,1||2||3||4,参考解析：<br>,流动资产,
220103040,下列各种情形中，小企业应对应收账款确认坏账损失的有{{c1::}}。,债务人依法宣告破产，其清算财产不足清偿的<br>||债务人逾期3年以上未清偿，且有确凿证据证明已无力清偿债务的<br>||因自然灾害导致应收账款无法收回的<br>||与债务人达成债务重组协议后，无法追偿的<br>,1||2||3||4,参考解析：小企业满足下列条件之一的，应对应收款项确认坏账损失：<br>①债务人依法宣告破产、关闭、解散、被撤销，或者被依法注销、吊销营业执照，其清算财产不足清偿的；<br>②债务人死亡，或者依法被宣告失踪、死亡，其财产或者遗产不足清偿的；<br>③债务人逾期3年以上未清偿，且有确凿证据证明已无力清偿债务的；<br>④与债务人达成债务重组协议或法院批准破产重整计划后，无法追偿的；<br>⑤因自然灾害、战争等不可抗力导致无法收回的；<br>⑥国务院财政、税务主管部门规定的其他条件。<br>,流动资产,
220103041,下列关于备抵法核算信用减值损失优缺点的表述中，正确的有{{c1::}}。,不符合权责发生制原则<br>||符合谨慎性会计信息质量要求<br>||计算的预期信用减值损失的金额不准确<br>||企业存在操纵利润的空间<br>,2||3||4,参考解析：选项A，备抵法符合权责发生制原则。<br>,流动资产,
220103042,关于存货清查，下列表述中正确的有{{c1::}}。,盘盈存货应计入营业外收入<br>||存货盘盈或盘亏均应通过“待处理财产损溢”科目核算<br>||管理不善造成存货盘亏的净损失应计入管理费用<br>||自然灾害造成存货盘亏的净损失应计入营业外支出<br>,2||3||4,参考解析：选项A，盘盈存货应冲减管理费用。<br>,流动资产,
220103043,下列关于包装物的处理中，应记入“其他业务成本”的有{{c1::}}。,出借包装物成本的摊销<br>||出租包装物成本的摊销<br>||随同产品出售单独计价的包装物成本<br>||随同产品出售不单独计价的包装物成本<br>,2||3,参考解析：选项AD，应记入“销售费用”科目。<br>,流动资产,
220103044,下列各项中，企业应计入存货成本的有{{c1::}}。,为特定客户设计产品发生的可直接确定的设计费用<br>||发出委托加工材料负担的运输费用<br>||自制存货发生的直接材料、直接人工和制造费用<br>||购进原材料运输途中发生的合理损耗<br>,1||2||3||4,参考解析：<br>,流动资产,
220103045,下列各项中，关于原材料按计划成本核算的会计处理表述正确的有{{c1::}}。,入库材料的超支差异应借记“材料成本差异”科目<br>||发出材料应负担的节约差异应借记“材料成本差异”科目<br>||发出材料应负担的超支差异应贷记“材料成本差异”科目<br>||入库材料的节约差异应借记“材料成本差异”科目<br>,1||2||3,参考解析：选项D，入库材料的节约差异应记入“材料成本差异”科目的贷方。<br>,流动资产,
220103046,下列各项中，会引起交易性金融资产账面价值发生变化的有{{c1::}}。,期末交易性金融资产的账面价值与公允价值不同<br>||出售交易性金融资产<br>||确认作为交易性金融资产核算的债券的利息收入<br>||被投资单位宣告分配现金股利<br>,1||2,参考解析：选项A，由于交易性金融资产是以公允价值计量的，期末应按照账面价值和公允价值的差额调增或调减交易性金融资产的账面价值；选项B，使得交易性金融资产账面价值减少；选项C，应借记“应收利息”科目，贷记“投资收益”科目，不影响交易性金融资产的账面价值；选项D，应借记“应收股利”科目，贷记“投资收益”科目，不影响交易性金融资产的账面价值。<br>,流动资产,
220103047,下列关于消耗性生物资产的成本表述中，正确的有{{c1::}}。,收获前耗用的材料费（种子、肥料等）、人工费和应分摊的间接费用应计入自行栽培的 蔬菜成本<br>||郁闭前发生的造林费、抚育费、调查设计费用等以及应分摊的间接费用应计入自行营造 的林木类成本<br>||出售前发生的饲料费、人工费和应分摊的间接费用应计入自行繁殖的育肥畜的成本<br>||水产类养殖动物在入库前耗用的苗种、饲料、人工费和应分摊的间接费用应计入当期损益<br>,1||2||3,参考解析：选项D，水产养殖的动物成本包括出售或入库前耗用的苗种、饲料等材料费、人工费和应分摊的间接费用。<br>,流动资产,
220103048,下列与存货相关的会计处理的表述中，正确的有{{c1::}}。,因台风造成的净损失，计入营业外支出<br>||资产负债表日存货应按成本与可变现净值孰低计量<br>||按管理权限报经批准的存货的盘盈，应冲减管理费用<br>||结转商品销售成本的同时应结转其已计提的存货跌价准备<br>,1||2||3||4,参考解析：<br>,流动资产,
220103049,企业的各项应收款项，都存在发生坏账损失的风险。因此，按现行制度规定都可以提取一定比例的坏账准备。{{c1::}},对<br>||错<br>,1,参考解析：<br>,流动资产,
220103050,交易性金融资产期末采用公允价值计量，不计提减值准备。{{c1::}},对<br>||错<br>,1,参考解析：<br>,流动资产,
220103051,已验收入库但至月末尚未收到增值税扣税凭证的赊购货物，应按合同协议价格计算增值税进项税额并暂估入账。{{c1::}},对<br>||错<br>,2,参考解析：对于材料已到达并已验收入库，但发票账单等结算凭证未到，货款尚未支付的采购业务，应于期末按材料的暂估价值，借记“原材料”科目，贷记“应付账款——暂估应付账款”科目，但增值税进项税额不能暂估入账。<br>,流动资产,
220103052,企业附有向其他方交付现金或其他金融资产的合同义务的，应确认一项金融资产。{{c1::}},对<br>||错<br>,2,参考解析：金融资产是从其他方收取现金或其他金融资产的合同权利，本题产生的是义务，所以不会形成金融资产。<br>,流动资产,
220103053,小企业可以根据自身情况，自行选择备抵法或直接转销法核算应收款项的减值。{{c1::}},对<br>||错<br>,2,参考解析：小企业应采用直接转销法核算应收款项的减值。<br>,流动资产,
220103054,不含重大融资成分的应收款项，企业应当始终按照相当于整个存续期内预期信用损失的金额计量其损失准备。{{c1::}},对<br>||错<br>,1,参考解析：<br>,流动资产,
220103055,年末，如果“应交税费——转让金融商品应交增值税”科目有借方余额，说明本年度的金融商品转让损失无法弥补，可以转入下年度继续抵减转让金融资产的收益。{{c1::}},对<br>||错<br>,2,参考解析：年末，如果“应交税费——转让金融商品应交增值税”科目有借方余额，说明本年度的金融商品转让损失无法弥补，不能转入下年度继续抵减转让金融资产的收益，应将借方余额转出。<br>,流动资产,
220103056,采用移动加权平均法可以在月度内随时结转发出存货的成本。{{c1::}},对<br>||错<br>,1,参考解析：采用月末一次加权平均法，只在月末一次计算加权平均单价和发出存货成本，并不能随时通过账簿记录得到发出和结存材料的单价和金额。而移动加权平均法可以在月度内随时结转发出存货的成本。<br>,流动资产,
220103057,低值易耗品在摊销完毕时，“周转材料——低值易耗品”的相关明细科目的余额应为0。{{c1::}},对<br>||错<br>,1,参考解析：<br>,流动资产,
220103058,原材料采用计划成本法核算的，购入的材料无论是否验收入库，均需先通过“材料采购”科目进行核算。{{c1::}},对<br>||错<br>,1,参考解析：在计划成本法下，购入的材料无论是否验收入库，都要先通过“材料采购”科目进行核算，以反映企业所购材料的实际成本。<br>,流动资产,
220103059,资产负债表日，对于为生产而持有的材料，不论其生产的产成品的可变现净值是否高于成本，都应将该材料的可变现净值与成本进行比较，确定材料是否发生减值。{{c1::}},对<br>||错<br>,2,参考解析：判断用于生产产品的材料是否发生减值时，应先确定用该原材料生产的最终产品是否发生减值。如果产品未发生减值，则即使材料的账面价值（成本）已高于市场价格，也不应计提存货跌价准备。<br>,流动资产,
220103060,小企业在采购商品过程中发生的进货费用，应先进行归集，等期末在已售商品和未售商品之间分摊。{{c1::}},对<br>||错<br>,2,参考解析：小企业的进货费用，应计入销售费用。<br>,流动资产,
220103061,对于商业承兑汇票贴现，应将实际收到的金额与票面金额的差额，借记或贷记“管理费用”。{{c1::}},对<br>||错<br>,2,参考解析：对于票据贴现，企业通常应按实际收到的金额，借记“银行存款”科目，按应收票据的票面金额，贷记“应收票据”科目，按其差额，记入“财务费用”科目。<br>,流动资产,
220103062,企业由于预付款业务不多，不单独设置“预付账款”科目，对于预付的款项应通过“应付账款”科目核算。{{c1::}},对<br>||错<br>,1,参考解析：不单独设置“预付账款”科目的企业，预付的款项可以通过“应付账款”科目核算。<br>,流动资产,
220103063,如果企业采用先进先出法核算发出存货成本，则在物价持续上升时会高估企业当期利润。{{c1::}},对<br>||错<br>,1,参考解析：在物价持续上升时，采用先进先出法核算发出存货的成本，会高估企业当期利润和库存存货价值；反之，会低估企业存货价值和当期利润。<br>,流动资产,
220103064,资产负债表日，当存货成本低于可变现净值时，存货按成本计价，当可变现净值低于成本时，存货按可变现净值计价。{{c1::}},对<br>||错<br>,1,参考解析：期末，存货应按照成本与可变现净值孰低计量。<br>,流动资产,
220103065,消耗性生物资产收获为农产品时，应按其账面余额，借记“农产品”科目，贷记“消耗性生物资产”科目。{{c1::}},对<br>||错<br>,1,参考解析：<br>,流动资产,
220103066,出售消耗性生物资产，按照实际收到的价款与其账面余额的差额计入投资收益。{{c1::}},对<br>||错<br>,2,参考解析：出售时，会计处理为：<br>借：银行存款等（实际收到的价款）<br>贷：主营业务收入等<br>借：主营业务成本等（账面余额）<br>贷：消耗性生物资产<br>,流动资产,
