id,question,options,answer,notes,Tags,questionPre
220101001,下列各项中，不属于会计监督的内容是{{c1::}}。,财务收支的合理性审查<br>||不定期进行的财产清查<br>||会计核算的完整性审查<br>||经济业务的真实性审查<br>,2,参考解析：会计监督是对真实性、完整性、合法性和合理性进行审查。<br>,概述,
220101002,下列有关会计主体的表述中，不正确的是{{c1::}}。,会计主体是指会计所核算和监督的特定单位和组织<br>||会计主体界定了从事会计工作和提供会计信息的时间范围<br>||由若干具有法人资格的企业组成的企业集团也是会计主体<br>||会计主体界定了从事会计工作和提供会计信息的空间范围<br>,2,参考解析：会计主体界定了从事会计工作和提供会计信息的空间范围。<br>,概述,
220101003,下列各项中，体现谨慎性要求的是{{c1::}}。,对固定资产采用年限平均法计提折旧<br>||低估负债<br>||高估资产<br>||确认预计负债<br>,4,参考解析：谨慎性要求企业对交易或者事项进行会计确认、计量、记录和报告应当保持应有的谨慎，不应高估资产或者收益、低估负债或者费用。<br>,概述,
220101004,下列关于会计职能的表述不正确的是{{c1::}}。,核算是最基本的职能<br>||核算和监督都是基本职能<br>||没有核算提供的信息，监督就失去了依据<br>||监督属于会计的拓展职能<br>,4,参考解析：核算和监督是会计的基本职能。<br>,概述,
220101005,企业对已发生减值的固定资产计提减值准备，体现了{{c1::}}要求。,实质重于形式<br>||重要性<br>||谨慎性<br>||可比性<br>,3,参考解析：计提资产减值准备体现了谨慎性要求，但为调节利润计提减值准备属于滥用会计政策，不符合谨慎性要求。<br>,概述,
220101006,企业将租入的资产（短期租赁和低值资产租赁除外）视为企业的资产，在企业的资产负债表中予以确认，体现的是{{c1::}}要求。,谨慎性<br>||实质重于形式<br>||可比性<br>||重要性<br>,2,参考解析：<br>,概述,
220101007,下列对重要性的表述不正确的是{{c1::}}。,对于重要的会计事项，必须按照规定的会计方法和程序进行处理，并在财务报告中予以充分、准确地披露<br>||对于次要的会计事项，在不影响会计信息真实性和不至于误导财务报告使用者作出正确判断的前提下，可适当简化处理<br>||要求企业提供的会计信息应当反映与企业财务状况、经营成果和现金流量有关的所有重要交易或者事项<br>||在评价某些项目的重要性时，不应依赖于会计人员的职业判断<br>,4,参考解析：在评价某些项目的重要性时，应依赖于会计人员的职业判断。<br>,概述,
220101008,下列关于权责发生制的表述中，不正确的是{{c1::}}。,权责发生制是以收入和费用是否归属本期为标准来确认本期收入和费用的一种方法<br>||权责发生制要求，凡是不属于当期的收入和费用，即使款项已在当期收付，也不作为当期的收入和费用<br>||权责发生制要求，凡是当期已经实现的收入和已经发生或应当负担的费用，无论款项是否收付，都应当作当期的收入和费用<br>||权责发生制要求，应以实际收到或支付现金作为确认收入和费用的标准<br>,4,参考解析：选项D，属于收付实现制的要求。<br>,概述,
220101009,下列各项中，属于遵守客观公正会计职业道德的是{{c1::}}。,遵纪守法，一身正气<br>||坚持职业标准，严格自我约束<br>||忠于职守、尽心尽力、尽职尽责<br>||实事求是，不偏不倚<br>,4,参考解析：选项AB，属于遵守廉洁自律会计职业道德；选项C，属于遵守爱岗敬业会计职业道德。<br>,概述,
220101010,内部环境作为内部控制要素之首，是实施内部控制的{{c1::}}。,基础<br>||重要环节<br>||重要条件<br>||重要保证<br>,1,参考解析：<br>,概述,
220101011,财务报告使用者主要包括{{c1::}}。,投资者<br>||债权人<br>||政府及其有关部门<br>||社会公众<br>,1||2||3||4,参考解析：<br>,概述,
220101012,下列各项中，属于会计监督合理性审查内容的有{{c1::}}。,检查各项财务收支是否符合特定对象的财务收支计划<br>||检查各项财务收支是否符合内部控制制度要求<br>||检查各项财务收支是否执行了国家的各项方针政策<br>||检查各项财务收支是否有利于预算目标的实现<br>,1||2||4,参考解析：选项C，是否执行了国家的各项方针政策属于合法性审查。<br>,概述,
220101013,会计基础是指会计确认、计量、记录和报告的基础，包括{{c1::}}。,历史成本<br>||权责发生制<br>||重置成本<br>||收付实现制<br>,2||4,参考解析：选项AC，属于会计计量属性。<br>,概述,
220101014,下列各项中，属于企业会计信息质量要求的有{{c1::}}。,收付实现制<br>||可靠性<br>||及时性<br>||历史成本<br>,2||3,参考解析：会计信息质量要求是对企业财务报告中所提供会计信息质量的基本要求，是使财务报告中所提供会计信息对投资者等使用者决策有用应具备的基本特征，它主要包括可靠性、相关性、可理解性、可比性、实质重于形式、重要性、谨慎性和及时性等。选项A，属于会计基础；选项D，属于会计计量属性。<br>,概述,
220101015,下列关于企业会计信息质量要求中实质重于形式的表述，正确的有{{c1::}}。,应以实际发生的交易或事项为依据进行会计确认、计量、记录和报告<br>||应按照交易或事项的经济实质进行会计确认、计量、记录和报告<br>||不应仅以交易或者事项的法律形式为依据<br>||应仅以交易或者事项的法律形式为依据<br>,2||3,参考解析：选项A，属于可靠性的要求；选项D，实质重于形式要求企业应当按照交易或事项的经济实质进行会计确认、计量、记录和报告，不应仅以交易或者事项的法律形式为依据。<br>,概述,
220101016,下列各项中，体现了可理解性要求的有{{c1::}}。,企业提供的会计信息应当清晰明了<br>||企业提供的会计信息应当相互可比<br>||便于财务会计报告使用者理解和使用<br>||有助于信息的使用者进行经济决策<br>,1||3||4,参考解析：可理解性要求企业提供的会计信息应当清晰明了、简明扼要，数据记录和文字说明能一目了然地反映出经济活动的来龙去脉，便于财务会计报告使用者理解和使用。选项B，属于可比性要求。<br>,概述,
220101017,下列各项中，体现了可靠性要求的有{{c1::}}。,各类企业执行的会计政策应当统一，便于比较<br>||以实际发生的交易或者事项为依据进行确认、计量<br>||如实反映符合确认和计量要求的会计要素<br>||在财务报告中的会计信息应当是真实、完整的<br>,2||3||4,参考解析：选项A，体现可比性要求。<br>,概述,
220101018,下列各项中，关于及时性的表述正确的有{{c1::}}。,要求企业对于已发生的交易或事项应当及时进行确认、计量、记录和报告，可以提前<br>||要求企业及时处理会计信息<br>||要求企业及时收集会计信息<br>||要求企业及时地将编制的财务报告传递给财务报告使用者<br>,2||3||4,参考解析：选项A，及时性要求企业对于已发生的交易或者事项，应当及时进行确认、计量、记录和报告，不得提前或延后。<br>,概述,
220101019,根据权责发生制，企业发生下列业务后，不应计入本期费用的有{{c1::}}。,预付下季度报刊费6000元<br>||摊销本月负担的杂志费2000元<br>||本月发生房屋租金1000元，尚未支付<br>||支付上月水电费3200元<br>,1||4,参考解析：选项A，预付下季度的报刊费应在下季度各个月份分别确认费用；选项D，应在上月确认费用。<br>,概述,
220101020,下列各项关于会计职业道德的表述正确的有{{c1::}}。,具有很强的他律性<br>||侧重于调整会计人员外在行为的合法化<br>||其表现形式既有成文的规范，也有不成文的规范<br>||以行业行政管理规范和道德评价为标准<br>,3||4,参考解析：选项A，会计职业道德具有很强的自律性；选项B，会计职业道德不仅调整会计人员的外在行为，还调整会计人员内在的精神世界。<br>,概述,
220101021,下列属于会计职业道德的有{{c1::}}。,诚实守信<br>||提高技能<br>||参与管理<br>||强化服务<br>,1||2||3||4,参考解析：会计职业道德包括爱岗敬业、诚实守信、廉洁自律、客观公正、坚持准则、提高技能、参与管理、强化服务。<br>,概述,
220101022,下列各项中，属于联合惩戒措施的有{{c1::}}。,记入会计从业人员信用档案<br>||依法限制其担任国有企业法定代表人<br>||依法限制参与评先、评优或取得荣誉称号<br>||实行行业惩戒<br>,1||2||3||4,参考解析：<br>,概述,
220101023,相比收付实现制，权责发生制更有利于计算和考核经营成果。{{c1::}},对<br>||错<br>,1,参考解析：采用权责发生制核算制度，能够更加准确地反映特定期间真实的财务状况及经营成果。<br>,概述,
220101024,会计基本假设是企业会计确认、计量、记录和报告的前提，是对会计核算所处时间、空间环境等所作的合理假定。{{c1::}},对<br>||错<br>,1,参考解析：<br>,概述,
220101025,合理确定内部控制要素有利于具体实施内部控制制度。{{c1::}},对<br>||错<br>,1,参考解析：<br>,概述,
220102001,下列关于会计计量属性的说法中，正确的是{{c1::}}。,重置成本必须考虑货币时间价值<br>||可变现净值必须考虑货币时间价值<br>||历史成本无须考虑货币时间价值<br>||现值无须考虑货币时间价值<br>,3,参考解析：需要考虑货币时间价值的会计计量属性是现值。现值是指对未来现金流量以恰当的折现率进行折现后的价值，是考虑货币时间价值的一种计量属性。<br>,会计基础,
220102002,负债按照现在偿付该项债务所需支付的现金或现金等价物的金额计量的会计计量属性是{{c1::}}。,历史成本<br>||可变现净值<br>||现值<br>||重置成本<br>,4,参考解析：<br>,会计基础,
220102003,下列交易或事项中，属于企业日常活动的是{{c1::}}。,出售机器设备<br>||出租闲置设备<br>||对外捐赠<br>||出售无形资产<br>,2,参考解析：选项B，出租闲置设备属于企业除主营业务活动以外的其他业务活动，是企业的日常活动。选项ACD，均为非日常活动。<br>,会计基础,
220102004,下列各项中，不属于反映企业财务状况的会计要素是{{c1::}}。,资产<br>||负债<br>||所有者权益<br>||利润<br>,4,参考解析：反映财务状况的会计要素包括资产、负债和所有者权益。选项D，属于反映经营成果的会计要素。<br>,会计基础,
220102005,下列关于所有者权益的表述中，正确的是{{c1::}}。,所有者权益是指企业投资者投入的资本，即实收资本<br>||所有者权益由实收资本和资本公积构成<br>||所有者权益是指企业资产扣除负债后由所有者享有的剩余权益<br>||所有者权益中的留存收益由资本公积和未分配利润构成<br>,3,参考解析：所有者权益是指企业资产扣除负债后由所有者享有的剩余权益，所有者权益包括所有者投入的资本、其他综合收益、留存收益等。其中，留存收益包括盈余公积和未分配利润。<br>,会计基础,
220102006,下列有关“资产＝负债＋所有者权益”等式的表述不正确的是{{c1::}}。,该等式是编制资产负债表的依据<br>||该等式也称为静态会计等式<br>||该等式反映了资产、负债、所有者权益三要素之间的内在联系和数量关系<br>||该等式表明了某一时点的经营成果<br>,4,参考解析：“资产＝负债＋所有者权益”这一等式反映了资产、负债和所有者权益三要素之间的内在联系和数量关系，表明了企业某一时点的财务状况，因此上述等式也称为静态会计等式。<br>,会计基础,
220102007,下列各项中，导致企业资产与负债同时减少的是{{c1::}}。,接受投资者投入机器设备<br>||以银行存款购买原材料<br>||从银行提取现金<br>||以银行存款偿还银行借款<br>,4,参考解析：选项A，使得资产和所有者权益同时增加；选项B，使得资产内部一增一减；选项C，使得资产内部一增一减；选项D，使得资产和负债同时减少。<br>,会计基础,
220102008,下列各项中，按会计科目反映的经济内容分类，属于成本类科目的是{{c1::}}。,长期待摊费用<br>||主营业务成本<br>||其他业务成本<br>||劳务成本<br>,4,参考解析：选项A，属于资产类科目；选项BC，属于损益类科目。<br>,会计基础,
220102009,下列选项中，与“坏账准备”具有相同账户结构的是{{c1::}}。,固定资产<br>||无形资产<br>||累计摊销<br>||应收账款<br>,3,参考解析：“坏账准备”是应收账款的备抵账户，“累计摊销”是“无形资产”的备抵账户，借方登记减少额，贷方登记增加额，期末余额一般在贷方。选项ABD，均属于企业的资产，借方登记增加额，贷方登记减少额，期末余额一般在借方。<br>,会计基础,
220102010,下列属于损益类会计科目的是{{c1::}}。,生产成本<br>||制造费用<br>||主营业务收入<br>||劳务成本<br>,3,参考解析：选项ABD，均属于成本类会计科目。<br>,会计基础,
220102011,下列关于借贷记账法的表述中，错误的是{{c1::}}。,借贷记账法的记账规则是“有借必有贷，借贷必相等”<br>||借贷记账法以“借”和“贷”作为记账符号<br>||借贷记账法下，“借”表示增加，“贷”表示减少<br>||借贷记账法是我国法定的记账方法<br>,3,参考解析：借贷记账法下，“借”和“贷”仅作为记账符号，至于“借”表示增加，还是“贷”表示增加，取决于账户的性质与所记录经济内容的性质。通常而言，资产、成本和费用类账户的增加用“借”表示，减少用“贷”表示；负债、所有者权益和收入类账户的增加用“贷”表示，减少用“借”表示。<br>,会计基础,
220102012,借贷记账法下，余额试算平衡的直接依据是{{c1::}}。,资金运动规律<br>||财务状况等式<br>||账户结构<br>||有借必有贷，借贷必相等<br>,2,参考解析：试算平衡是以财务状况等式和借贷记账规则为理论依据的，其中发生额试算平衡的直接依据是记账规则（即“有借必有贷，借贷必相等”），余额试算平衡的直接依据是财务状况等式。<br>,会计基础,
220102013,下列各项业务中，应编制付款凭证的是{{c1::}}。,收回前欠货款30000元<br>||购入材料10000元，货款未付<br>||以银行存款归还前欠货款50000元<br>||接受投资者投入资金280000元<br>,3,参考解析：选项AD，应编制收款凭证；选项B，应编制转账凭证。<br>,会计基础,
220102014,下列各项中，属于企业累计原始凭证的是{{c1::}}。,增值税专用发票<br>||出差报销的火车票<br>||银行结算凭证<br>||限额领料单<br>,4,参考解析：累计凭证，是指多次记录同类型的经济业务且多次有效的原始凭证，如限额领料单。选项ABC，属于一次原始凭证。<br>,会计基础,
220102015,直接根据记账凭证逐笔登记总分类账的账务处理程序是{{c1::}}。,记账凭证账务处理程序<br>||汇总记账凭证账务处理程序<br>||科目汇总表账务处理程序<br>||日记账账务处理程序<br>,1,参考解析：直接根据记账凭证逐笔登记总分类账的账务处理程序是记账凭证账务处理程序。<br>,会计基础,
220102016,下列选项中，属于科目汇总表账务处理程序缺点的是{{c1::}}。,不便于理解<br>||增加了登记总分类账的工作量<br>||不便于检查核对账目<br>||不便于进行试算平衡<br>,3,参考解析：科目汇总表账务处理程序的缺点是科目汇总表不能反映各个账户之间的对应关系，不利于对账目进行检查。科目汇总报表账务处理程序的优点是减轻了登记总分类账的工作量，并且科目汇总表可以起到试算平衡的作用。<br>,会计基础,
220102017,下列说法中，属于订本式账簿优点的是{{c1::}}。,可以防止抽换账页<br>||便于记账分工<br>||可以根据需要随时增添账页<br>||账页可多可少，不会造成浪费<br>,1,参考解析：订本式账簿能避免账页散失和防止抽换账页，但是不能准确为各账户预留账页，预留太多造成浪费，预留太少影响登记。订本式账簿在同一时间只能由一人登记，这样不利于记账人员分工记账。<br>,会计基础,
220102018,在填制会计凭证时，￥2353.62元的大写金额数字为{{c1::}}。,人民币贰仟叁佰伍拾叁元陆角贰分<br>||人民币（空格）贰仟叁佰伍拾叁元陆角贰分<br>||人民币贰仟叁佰伍拾叁元陆角贰分整<br>||人民币贰仟叁佰伍拾叁元陆角贰分正<br>,1,参考解析：人民币与大写金额之间不得留空，因此选项B错误；大写金额有分的，不写“整”或“正”字，因此选项CD错误。<br>,会计基础,
220102019,下列各项中，对于金额有错误的原始凭证处理方法正确的是{{c1::}}。,由出具单位在凭证上更正并加盖出具单位公章<br>||由出具单位在凭证上更正并由经办人员签名<br>||由出具单位在凭证上更正并由单位负责人签名<br>||由出具单位重新开具<br>,4,参考解析：原始凭证金额有错误的，应当由出具单位重开，不得在原始凭证上更正。<br>,会计基础,
220102020,出纳人员发生变动时，对其保管的库存现金进行的清查属于{{c1::}}。,全面定期清查<br>||局部不定期清查<br>||全面不定期清查<br>||局部定期清查<br>,2,参考解析：在单位更换出纳和财产物资保管人员时，需要进行不定期清查；同时，对保管的库存现金进行清查属于局部清查。<br>,会计基础,
220102021,下列各项中，应采用技术推算法进行清查的是{{c1::}}。,露天堆放的煤炭<br>||银行存款<br>||固定资产<br>||应收账款<br>,1,参考解析：选项B，应采用与银行对账单核对的方式进行清查；选项C，应采用实地盘点的方法进行清查；选项D，应采用发函询证的方法进行清查。<br>,会计基础,
220102022,某公司2020年9月30日银行存款日记账的余额为150万元，经逐笔核对，发现未达账项如下：银行已收，企业未收的5万元；银行已付，企业未付的2万元。企业银行存款的实有数为{{c1::}}万元。,150<br>||153<br>||155<br>||157<br>,2,参考解析：企业银行存款的实有数＝银行存款日记账的余额＋银行已收企业未收的金额－银行已付企业未付的金额＝150＋5－2＝153（万元）。<br>,会计基础,
220102023,下列各项中，适合采用数量金额式账簿的是{{c1::}}。,库存商品明细账<br>||短期借款明细账<br>||银行存款日记账<br>||制造费用明细账<br>,1,参考解析：选项BC，一般采用三栏式账簿；选项D，一般采用多栏式账簿。<br>,会计基础,
220102024,2021年3月15日，某企业财务人员发现当月初登记入账的一笔交易出现记账错误，该笔交易的记账凭证和账簿记录中应借、应贷会计科目及记账方向无误，但所记金额小于应记账金额，可以采用的错账更正方法是{{c1::}}。,补充登记法<br>||红字更正法<br>||试算平衡法<br>||划线更正法<br>,1,参考解析：记账后发现记账凭证中会计科目无误，所记金额小于应记金额，导致账簿记录错误的，应采用补充登记法。<br>,会计基础,
220102025,下列各项中，属于外来原始凭证的是{{c1::}}。,支付运输费收到的增值税专用发票<br>||限额领料单<br>||发料凭证汇总表<br>||员工差旅费报销单<br>,1,参考解析：选项BCD，都属于自制原始凭证。<br>,会计基础,
220102026,某企业生产产品单价为10元/件，单位变动成本为6元/件，每年固定成本为40000元，每年生产12000件。则每年的营业利润为{{c1::}}元。,8000<br>||48000<br>||80000<br>||40000<br>,1,参考解析：营业利润＝（10－6）×12000－40000＝8000（元）。<br>,会计基础,
220102027,下列各项中，一般不属于成本项目的是{{c1::}}。,直接材料<br>||折旧费<br>||制造费用<br>||直接人工<br>,2,参考解析：对于制造企业，一般可设置“直接材料”“燃料及动力”“直接人工”和“制造费用”等成本项目。<br>,会计基础,
220102028,下列各项中，关于分批法的表述不正确的是{{c1::}}。,产品成本计算期与产品生产周期基本一致<br>||月末一般无需进行在产品与完工产品之间的费用分配<br>||适用于精密仪器制造<br>||产品成本计算期与财务报告期基本一致<br>,4,参考解析：选项D，分批法下，产品成本计算期与产品生产周期基本一致，但与财务报告期不一致。<br>,会计基础,
220102029,某项经济业务的发生没有增加负债，也没有减少负债，则可能导致的结果有{{c1::}}。,资产和所有者权益同时增加<br>||资产和所有者权益同时减少<br>||资产和所有者权益一增一减<br>||资产内部一增一减<br>,1||2||4,参考解析：根据“资产＝负债＋所有者权益”会计等式的恒等关系，选项C，破坏了等式的平衡关系。<br>,会计基础,
220102030,下列关于会计等式“收入－费用＝利润”的表述中，正确的有{{c1::}}。,该等式为反映企业经营成果的动态会计等式<br>||该等式表明了企业在一定会计期间经营成果与相应的收入和费用之间的关系<br>||该等式为反映企业财务状况的动态会计等式<br>||该等式反映的是企业资金的绝对运动形式，故也称为静态会计等式<br>,1||2,参考解析：“收入－费用＝利润”是反映企业经营成果的动态会计等式。<br>,会计基础,
220102031,下列各项中，企业应确认为负债的有{{c1::}}。,向银行借入的款项<br>||因购买材料应付未付的款项<br>||为销售商品而预收的定金<br>||因销售商品而应收的款项<br>,1||2||3,参考解析：选项D，因销售商品而应收的款项应确认为应收账款，属于资产。<br>,会计基础,
220102032,下列各项中，关于会计计量属性的表述正确的有{{c1::}}。,盘盈的固定资产应按重置成本确定其入账价值<br>||期末存货应当按照成本与可变现净值孰低进行计量<br>||交易性金融资产应按照公允价值计量<br>||对会计要素计量时，一般采用历史成本计量属性<br>,1||2||3||4,参考解析：<br>,会计基础,
220102033,原始凭证按填制手续及内容不同分为{{c1::}}。,一次凭证<br>||累计凭证<br>||汇总凭证<br>||外来凭证<br>,1||2||3,参考解析：选项D，外来原始凭证属于按照取得来源进行的分类。<br>,会计基础,
220102034,运用借贷记账法编制会计分录时，可以编制{{c1::}}。,一借一贷的分录<br>||多借多贷的分录<br>||多借一贷的分录<br>||一借多贷的分录<br>,1||2||3||4,参考解析：<br>,会计基础,
220102035,在借贷记账法下，下列各项中期末一般有借方余额的会计账户有{{c1::}}。,成本类账户<br>||负债类账户<br>||损益类账户<br>||资产类账户<br>,1||4,参考解析：选项B，负债类账户期末一般有贷方余额；选项C，损益类账户期末无余额。<br>,会计基础,
220102036,下列关于记账凭证的表述中，正确的有{{c1::}}。,按反映的经济内容可分为收款凭证、付款凭证和转账凭证<br>||转账凭证是用于记录不涉及库存现金和银行存款业务的记账凭证<br>||付款凭证是用于记录库存现金和银行存款付款业务的记账凭证<br>||收款凭证是用于记录库存现金和银行存款收款业务的记账凭证<br>,1||2||3||4,参考解析：<br>,会计基础,
220102037,在原始凭证上书写小写金额时，下列各项中，正确的有{{c1::}}。,有角无分的，分位不得用“-”代替<br>||无角无分的，角位和分位写“00”或者符号“-”<br>||有角无分的，分位应当写“0”<br>||人民币符号“￥”与阿拉伯数字之间不得留有空白<br>,1||2||3||4,参考解析：<br>,会计基础,
220102038,下列各项中，不属于企业外来原始凭证的有{{c1::}}。,内部使用的借款单<br>||领料单<br>||产品入库单<br>||职工出差报销的飞机票<br>,1||2||3,参考解析：选项ABC，属于企业自制原始凭证。<br>,会计基础,
220102039,下列各项中，会计账簿按用途不同可分为{{c1::}}。,分类账簿<br>||序时账簿<br>||备查账簿<br>||数量金额式账簿<br>,1||2||3,参考解析：会计账簿按用途不同可以分为序时账簿、分类账簿和备查账簿。按账页格式可以分为三栏式账簿、多栏式账簿和数量金额式账簿。<br>,会计基础,
