id,question,options,answer,notes,Tags,questionPre
220201001,下列选项中，不属于我国法的渊源的是{{c1::}}。,国际条约<br>||最高人民法院所作的判决<br>||部门规章<br>||地方性法规<br>,2,参考解析： 最高人民法院所作的“判决书”或发布的“指导案例”等，没有法律效力，不产生法的强制力，不属于我国法的渊源。<br>,总论,
220201002,下列规范性文件中，属于行政法规的是{{c1::}}。,国务院发布的《企业财务会计报告条例》<br>||全国人民代表大会通过的《中华人民共和国民事诉讼法》<br>||中国人民银行发布的《支付结算办法》<br>||全国人民代表大会常务委员会通过的《中华人民共和国会计法》<br>,1,参考解析：选项B、D，属于法律；选项C，属于部门规章。<br>,总论,
220201003,根据法的空间效力、时间效力或对人的效力划分，可以分为{{c1::}}。,普通法与特别法<br>||一般法与特别法<br>||根本法与普通法<br>||公法与私法<br>,2,参考解析： 选项C，根据法的内容、效力和制定程序，划分为根本法与普通法；选项D，根据法律运用的目的，划分为公法与私法。<br>,总论,
220201004,下列法的效力中，其域内效力仅在我国局部地区有效的是{{c1::}}。,全国人民代表大会制定的法律<br>||国务院制定的部门规章<br>||民族自治地方制定的自治条例与单行条例<br>||宪法<br>,3,参考解析： 按照法的空间效力划分，可分为在全国范围内有效和在局部地区有效。其中，地方性法规、地方政府规章、民族自治地方制定的自治条例与单行条例，在其管辖范围内有效。<br>,总论,
220201005,张某睡懒觉醒来后肚子饿了，于是用手机某APP点外卖吃晚饭。下列选项中，构成法律事实的是{{c1::}}。,张某睡醒睁开眼<br>||张某肚子饿了<br>||张某通过APP点单<br>||外卖送来，张某开心的吃饭<br>,3,参考解析：法律事实是由法律规范所确定，能够“直接引起”某种类型法律关系发生、变更和消灭的法律后果。选项ABD是生活事实，并不具备法律上的效果，因此不是法律事实；选项C，属于法律事实中的法律行为，具有法律效果，可直接形成：①张某与饭店的餐饮服务法律关系；②张某、饭店与外卖平台的运输服务法律关系。<br>,总论,
220201006,下列各项中，属于法律事实中的法律行为的是{{c1::}}。,水星逆行<br>||一段时间的经过<br>||自然人订立自书遗嘱<br>||十月怀胎，一朝分娩<br>,3,参考解析：法律行为是指以法律关系主体意志为转移，能够引起法律后果的活动。选项BD，属于法律事件；选项A，通常不影响法律关系，属非法律事实。<br>,总论,
220201007,法律关系客体的内容和范围由法律规定，下列选项中，属于我国法律关系客体的是{{c1::}}。,自然人<br>||人的人身和人格<br>||美女头上秀美的长发<br>||空气<br>,2,"参考解析： 选项A,人的整个身体只能成为主体，不是法律关系的客体；选项B,人身、人格是生命权、身体权、健康权、肖像权、名誉权、隐私权等人身权指向的客体；选项C，人的头发、血液、骨髓、精子和其他器官，构成人的整体时，不属于客体，但依法从身体中分离出去，成为独立的外部之物时，可以依法成为客体；选项D，空气不具备稀缺性，通常不属于法律关系客体中的“物”。<br>",总论,
220201008,关于法律关系客体中的人格、人身，下列选项中，说法正确的是{{c1::}}。,禁止侵犯他人的名誉权，其法律义务指向的客体是物<br>||人格、人身是人身权指向的客体<br>||人的整体既可以成为法律关系的主体，又可以成为法律关系的客体<br>||人的血液从身体分离出去后，即不可能再成为法律关系的客体<br>,2,参考解析：人格、人身是禁止侵犯他人名誉权等法律义务所指向的客体，选项A的说法错误；人的整体只能是法律关系的主体，不能作为法律关系的客体，因此选项C的说法错误；人的部分是可以作为客体的“物”，如当人的头发、血液、骨髓、精子和其他器官从身体中分离出去，成为与身体相分的外部之物时，在某些情况下也可视为法律上的“物”，因此选项D的说法错误。<br>,总论,
220201009,下列各项中，不属于法律关系主体的是{{c1::}}。,甲市商务主管部门<br>||乙市红十字会<br>||丙市A区居民委员会<br>||会跑酷与跳舞的智能机器人Atlas<br>,4,参考解析： 法律关系主体的种类包括自然人、法人组织、非法人组织和国家。选项D属于法律关系客体中“物”的范畴，并非主体。<br>,总论,
220201010,下列关于法人的法定代表人的说法中，正确的是{{c1::}}。,法定代表人因执行职务造成他人损害的，由法人承担民事责任<br>||法定代表人以法人名义从事的民事活动，其法律后果由自身承受<br>||法定代表人是一种组织，包括营利性与非营利性<br>||法人章程或者法人权力机构不得对法定代表人代表权进行限制<br>,1,参考解析：选项B错误，法定代表人以法人名义从事的民事活动，其法律后果由“法人”承受；选项C错误，依照法律或者法人章程的规定，代表法人从事民事活动的负责人，为法人的法定代表人。注意，法定代表人一定是自然人；选项D错误，法人章程或者法人权力机构可以对法定代表人代表权进行限制，只是不得对抗善意相对人。<br>,总论,
220201011,下列关于法人合并与分立的说法中，正确的是{{c1::}}。,法人分立的，其权利和义务一律由分立后的法人享有连带债权，承担连带债务<br>||法人合并的，其权利和义务由合并前的法人享有和承担<br>||法人合并的，其权利和义务由合并后的法人享有和承担<br>||法人分立的，其权利和义务一律由分立前的法人享有连带债权，承担连带债务<br>,3,参考解析： 选项AD错误，根据规定，法人分立的，其权利和义务由“分立后”的法人享有连带债权，承担连带债务，“但是债权人和债务人另有约定的除外”；选项B错误，法人合并的，其权利和义务由“合并后”的法人享有和承担。<br>,总论,
220201012,下列主体中，属于非法人组织的是{{c1::}}。,基金会<br>||上市公司<br>||社会团体<br>||个人独资企业<br>,4,参考解析： 非法人组织包括个人独资企业、合伙企业、不具有法人资格的专业服务机构等。<br>,总论,
220201013,下列关于法律主体权利能力的说法中，正确的是{{c1::}}。,权利能力，是法律主体能够通过自己的行为实际取得权利和履行义务的能力<br>||权利能力是自然人独有的资格，法人和非法人组织均无权利能力<br>||不满8周岁的自然人，不具有民事权利能力<br>||自然人的民事权利能力一律平等<br>,4,参考解析：选项A错误，权利能力，是法律主体能够参加某种法律关系，依法享有一定权利和承担一定义务的法律资格；选项B错误，法人亦享有权利能力，由法人成立时的宗旨和业务范围决定；选项C错误，自然人自出生时起到死亡时止，具有民事权利能力。<br>,总论,
220201014,根据《民法典》的规定，下列自然人中，属于限制民事行为能力人的是{{c1::}}。,赵某，16周岁，在某超市上班<br>||王某，15周岁，在校学生<br>||张某，20周岁，辍学在家赋闲<br>||李某，10周岁，不能辨认自己行为<br>,2,参考解析：选项A，16周岁以上（≥16周岁）的未成年人，以自己的劳动收入为主要生活来源的，视为完全民事行为能力人；选项C，属于完全民事行为能力人；选项D，属于无民事行为能力人。<br>,总论,
220201015,经济主体违反经济法律规定，应承担民事责任的方式是{{c1::}}。,罚款<br>||赔偿损失<br>||罚金<br>||暂扣或吊销许可证<br>,2,参考解析：根据规定，经济主体承担民事责任的方式有：停止侵害；排除妨碍；消除危险；返还财产；恢复原状；修理、重作、更换；继续履行；赔偿损失；支付违约金；消除影响、恢复名誉；赔礼道歉等。罚款、暂扣或吊销许可证属于行政责任。罚金属于刑事责任。 【易错提示】注意民事责任、行政责任和刑事责任的划分。<br>,总论,
220201016,下列法律责任形式中，属于行政责任的是{{c1::}}。,没收违法所得<br>||赔偿损失<br>||剥夺政治权利<br>||恢复原状<br>,1,参考解析： 选项C，属于刑事责任中的附加刑；选项BD，属于民事责任。<br>,总论,
220201017,下列规范性文件中，属于规章的有{{c1::}}。,国务院发布的《企业财务会计报告条例》<br>||上海市人民政府发布的《上海市旅馆业管理办法》<br>||财政部发布的《金融企业国有资产转让管理办法》<br>||北京市人大常委会发布的《北京市城乡规划条例》<br>,2||3,参考解析：规章包括部门规章和地方政府规章。选项A属于行政法规；选项B属于地方政府规章；选项C属于部门规章；选项D属于地方性法规。<br>,总论,
220201018,下列属于我国法的终止方式的有{{c1::}}。,由新法明确规定旧法废止<br>||由有权的国家机关发布专门的决议、决定，废除某些法律<br>||同一国家机关制定的新法与旧法对同一事项规定相冲突时，旧法中的相应条款效力终止，即新法优于旧法适用<br>||完成一定历史任务后终止不再适用<br>,1||2||3||4,参考解析：<br>,总论,
220201019,下列关于法的效力等级及其适用规则的表述中，正确的有{{c1::}}。,上位法优于下位法<br>||特别法优于一般法<br>||行政法规之间对同一事项的新的一般规定与旧的特别规定不一致，不能确定如何适用时，由国务院裁决<br>||法律之间对同一事项的新的一般规定与旧的特别规定不一致，不能确定如何适用时，由全国人大常委会裁决<br>,1||2||3||4,参考解析：<br>,总论,
220201020,下列各项中，能够引起法律关系发生、变更和消灭的事实的有{{c1::}}。,暴雨导致投保汽车受损<br>||知名艺人涉嫌犯罪被刑拘<br>||知名企业出资100亿元设立共同富裕支持基金<br>||环球影城向社会开放游览<br>,1||2||3||4,参考解析：选项A属于法律事实中的法律事件（引起保险赔偿等法律关系产生）；选项BCD均属于法律事实中的法律行为。<br>,总论,
220201021,根据民事法律制度的规定，下列属于法律事件的有{{c1::}}。,自然人的出生与死亡<br>||收养孤儿<br>||爆发战争<br>||签发支票<br>,1||3,参考解析： 选项AC，自然人的出生与死亡和爆发战争是当事人无法控制、无法预见的事件，属于法律事件。选项BD，收养孤儿和签发支票则是人有意识的行为，可以产生相应的法律后果，属于法律行为。<br>,总论,
220201022,根据民事法律制度的规定，下列属于法律关系客体的有{{c1::}}。,电力和热力<br>||实用新型<br>||微博账号<br>||完成一定劳务的行为<br>,1||2||3||4,参考解析：选项A属于法律关系客体中的“物”；选项B属于“智力成果”；选项C属于“信息、数据、网络虚拟财产”；选项D属于“行为”。<br>,总论,
220201023,张三、李四和王五设立甲公司，根据民事法律制度规定，下列关于设立甲公司过程中所涉规则的说法中，正确的有{{c1::}}。,张三为设立甲公司从事的民事活动，其法律后果由甲公司承受<br>||李四为设立甲公司以李四名义从事民事活动产生的民事责任，其法律后果由甲公司承受<br>||甲公司设立失败未成立的，其法律后果由设立人张三、李四和王五承受<br>||甲公司设立失败未成立的，其法律后果只能由一名设立人承受<br>,1||3,"参考解析： 选项B错误,设立人为设立法人以“自己的名义”从事民事活动产生的民事责任，第三人有权选择请求法人或者设立人承担；选项D错误，法人未成立的，其法律后果由设立人承受，设立人为二人以上的，享有连带债权，承担连带债务。<br>",总论,
220201024,根据民事法律制度的规定，下列选项中，属于法人解散的情形有{{c1::}}。,法人章程规定的存续期间届满或者法人章程规定的其他解散事由出现<br>||法人的权力机构决议解散<br>||法人连续亏损<br>||法人依法被吊销营业执照<br>,1||2||4,参考解析：有下列情形之一的，法人解散：①法人章程规定的存续期间届满或者法人章程规定的其他解散事由出现；②法人的权力机构决议解散；③因法人合并或者分立需要解散；④法人依法被吊销营业执照、登记证书，被责令关闭或者被撤销；⑤法律规定的其他情形。<br>,总论,
220201025,根据民事法律制度的规定，下列关于法人清算的说法中，正确的有{{c1::}}。,法人解散的，一律需要清算<br>||法人进入清算期间，法人资格即终止<br>||清算结束并完成法人注销登记时，法人终止；依法不需要办理法人登记的，清算结束时，法人终止<br>||清算期间，清算义务人不得从事与清算无关的活动<br>,3||4,参考解析：选项A错误，法人解散的，除合并或者分立的情形外，清算义务人应当及时组成清算组进行清算；选项B错误，清算期间法人存续，但是不得从事与清算无关的活动。<br>,总论,
220201026,下列选项中，属于特别法人的有{{c1::}}。,国家机关<br>||登记为法人的清真寺<br>||城镇农村的合作经济组织法人<br>||农村集体经济组织法人<br>,1||3||4,"参考解析： 选项B,依法设立的宗教活动场所，具备法人条件的，可以申请法人登记，取得捐助法人资格，属于“非营利法人”。<br>",总论,
220201027,齐某今年17周岁，先天双臂残疾，但是精神状况正常，且天生练就双脚写书法的绝活，目前在一家书法协会工作，工作稳定。关于该情况，下列说法正确的有{{c1::}}。,齐某具有民事权利能力<br>||齐某是限制民事行为能力人<br>||应将齐某视为完全民事行为能力人<br>||齐某是无民事行为能力人<br>,1||3,参考解析：自然人的权利能力始于出生，终于死亡，因此选项A的说法正确；16周岁以上不满18周岁的自然人，以自己的劳动收入为主要生活来源的，视为完全民事行为能力人，因此选项C的说法正确。<br>,总论,
220201028,小明今年15周岁，因贩卖毒品被羁押，下列关于小明刑事责任能力的说法中，正确的有{{c1::}}。,应当负刑事责任<br>||应当从轻或减轻刑事处罚<br>||可以从轻或减轻刑事处罚<br>||不负刑事责任<br>,1||2,参考解析：已满14周岁不满16周岁的人，犯故意杀人、故意伤害致人重伤或者死亡、强奸、抢劫、贩卖毒品、放火、爆炸、投放危险物质罪的，应当负刑事责任。同时，已满12周岁不满18周岁的人犯罪，“应当”从轻或者减轻处罚。<br>,总论,
220201029,下列法律责任中，属于行政处罚的有{{c1::}}。,限制开展生产经营活动<br>||限制从业<br>||支付违约金<br>||罚金<br>,1||2,参考解析：选项C，属于民事责任；选项D，属于刑事责任中的附加刑。 【易错提示】罚款属于行政责任；罚金属于刑事责任。<br>,总论,
220201030,下列责任形式中，属于刑事责任的有{{c1::}}。,记过<br>||赔礼道歉<br>||拘役<br>||罚金<br>,3||4,参考解析：选项A，属于行政责任中的行政处分；选项B，属于民事责任；选项C，属于刑事责任中的主刑；选项D，属于刑事责任中的附加刑。<br>,总论,
220201031,王某见一辆汽车停在自家车位上，遂电话告知车主李某挪车。王某在等待期间怒火难消，用随身携带的喷漆将李某的车辆漆面喷毁，李某报警，王某被刑拘。后经鉴定，车损达到9000元。后家人积极主张赔偿李某车辆损失，人民法院依法判处王某拘役1个月。下列关于本案涉及法律责任的说法中，正确的有{{c1::}}。,赔偿李某车辆损失属于行政责任<br>||判处王某1个月拘役属于行政责任<br>||李某私自占用王某的车位，应承担排除妨碍的民事责任<br>||故意损害车辆造成的损失，王某应承担赔偿损失的民事责任<br>,3||4,参考解析： 选项A错误、D正确，赔偿损失属于民事责任；选项B错误，拘役、管制、有期徒刑、无期徒刑、死刑属于刑事责任中的主刑。<br>,总论,
220201032,法律、行政法规、地方性法规、自治条例和单行条例、规章不溯及既往，但为了更好地保护公民、法人和其他组织的权利和利益而作的特别规定除外。{{c1::}},对<br>||错<br>,1,参考解析：<br>,总论,
220201033,全国人民代表大会常务委员会制定的《中华人民共和国公司法》，其法律效力高于国务院制定的《中华人民共和国市场主体登记管理条例》。{{c1::}},对<br>||错<br>,1,参考解析：法律的效力优于行政法规。<br>,总论,
220201034,张老师养的一只母猫生了三只小猫，这属于法律事实中的法律事件。{{c1::}},对<br>||错<br>,1,参考解析：母猫生小猫属于自然事件，此事件让张老师获得了小猫的所有权，即事件导致所有权的发生。<br>,总论,
220201035,某网络带货主播通过虚假申报方式逃税10亿元，其逃税行为属于法律行为中的积极行为和违法行为。{{c1::}},对<br>||错<br>,1,参考解析：违法行为是指行为人实施的违反法律规范的要求、应承担不利的法律后果的行为。积极行为（作为）是主动作用于客体的、具有法律意义的行为。<br>,总论,
220201036,法律关系客体中的物，仅指有体物，不包括无体物。{{c1::}},对<br>||错<br>,2,参考解析：法律关系客体中的“物”，不仅包括有体物，也包括某种权利，如应收账款、知识产权等，依照物权法律制度规定，在特定的法律关系中（如质押）成为物权客体。<br>,总论,
220201037,法律予以保护的个人信息，是以电子或其他方式记录的与已识别或者可识别的自然人有关的各种信息，包括匿名化处理后的信息。{{c1::}},对<br>||错<br>,2,参考解析：个人信息，是以电子或其他方式记录的与已识别或者可识别的自然人有关的各种信息，“不包括”匿名化处理后的信息。<br>,总论,
220201038,自然人以户籍登记或者其他有效身份登记记载的居所为住所；经常居所与住所不一致的，经常居所视为住所。{{c1::}},对<br>||错<br>,1,参考解析：<br>,总论,
220201039,法人被宣告破产的，依法进行破产清算并完成法人注销登记时，法人终止。{{c1::}},对<br>||错<br>,1,参考解析：<br>,总论,
220201040,以取得利润并分配给股东等出资人为目的成立的法人，为特别法人。{{c1::}},对<br>||错<br>,2,参考解析：以取得利润并分配给股东等出资人为目的成立的法人，为营利法人。<br>,总论,
220201041,个人独资企业与合伙企业均具有法人资格。{{c1::}},对<br>||错<br>,2,参考解析：个人独资企业与合伙企业均属于非法人组织，不具有法人资格。<br>,总论,
220201042,非法人组织的财产不足以清偿债务的，其出资人或者设立人承担无限责任。法律另有规定的，依照其规定。{{c1::}},对<br>||错<br>,1,参考解析：<br>,总论,
220201043,某人醉酒后对女同事实施性侵犯，亦应负担刑事责任。{{c1::}},对<br>||错<br>,1,参考解析：<br>,总论,
220201044,甲、乙两家建筑公司因串通招标行为被住房建设管理部门依法降低了建筑资质等级，甲、乙公司承担的此法律责任为行政处分。{{c1::}},对<br>||错<br>,2,参考解析：暂扣许可证件、降低资质等级、吊销许可证件等法律责任形式，属于行政责任中的“行政处罚”。<br>,总论,
220201045,对犯罪分子不实行关押，但是限制其一定自由的刑事责任是拘役。{{c1::}},对<br>||错<br>,2,参考解析：管制，是对犯罪分子不实行关押，但是限制其一定的自由。<br>,总论,
220201046,对于应当判处死刑的犯罪分子，如果不是必须立即执行的，可以判处死刑同时宣告缓期两年执行。{{c1::}},对<br>||错<br>,1,参考解析：<br>,总论,
220202001,根据会计法律制度的规定，下列各项中，不属于会计核算内容的是{{c1::}}。,递延税款的余额调整<br>||货物买卖合同的审核<br>||有价证券溢价的摊销<br>||资本公积的增减变动<br>,2,参考解析：根据《会计法》规定，对于款项和有价证券的收付，财物的收发、增减和使用，债权债务的发生和结算，资本、基金的增减，收入、支出、费用、成本的计算，财务成果的计算和处理，以及需要办理会计手续、进行会计核算的其他事项，均应当办理会计手续、进行会计核算。选项B，不会发生直接的资金增减变动，不属于会计核算的范围。<br>,会计法律制度,
220202002,对记载不准确、不完整的原始凭证，会计人员应当{{c1::}}。,拒绝接受，并报告领导，要求查明原因<br>||应予以销毁，并报告领导，要求查明原因<br>||予以退回，并要求经办人员按规定进行更正、补充<br>||拒绝接受，且不能让经办人员进行更正、补充<br>,3,参考解析： 根据规定，会计机构、会计人员对不真实、不合法的原始凭证，不予受理；对记载不准确、不完整的原始凭证，予以退回，要求更正、补充。<br>,会计法律制度,
220202003,根据会计法律制度的规定，下列关于登记会计账簿基本要求的表述中，错误的是{{c1::}}。,在不设借贷等栏的多栏式账页中只登记增加数，不登记减少数<br>||会计账簿按页次顺序连续登记，不得跳行、隔页<br>||账簿中书写的文字和数字上面要留有适当空格，一般应占格距的二分之一<br>||按照红字记账凭证冲销错误记录时，可以用红色墨水记账<br>,1,参考解析：选项A错误，在不设借贷等栏的多栏式账页中用红字登记减少数。<br>,会计法律制度,
220202004,关于记账本位币，下列说法中，表述错误的是{{c1::}}。,业务收支以人民币以外的货币为主的单位，可以选定两种以上货币为记账本位币<br>||我国会计核算原则上以人民币为记账本位币<br>||记账本位币是指日常登记账簿和编制财务会计报告用以计量的货币<br>||以人民币以外的货币为记账本位币的，在编制财务会计报告时应折算成人民币<br>,1,参考解析：根据规定，业务收支以人民币以外的货币为主的单位，可以选定其中一种货币作为记账本位币，但是编报的财务会计报告应当折算成人民币。<br>,会计法律制度,
220202005,国有企业、国有控股的或者占主导地位的企业，应当向本企业的职工代表大会公布财务会计报告，该公布报告的时间要求是至少{{c1::}}。,每年一次<br>||每个月一次<br>||每个季度一次<br>||每半年一次<br>,1,参考解析：国有企业、国有控股的或者占主导地位的企业，应当至少每年一次向本企业的职工代表大会公布财务会计报告，并重点说明相关的事项。<br>,会计法律制度,
220202006,下列各项中，不属于会计档案的是{{c1::}}。,会计档案鉴定意见书<br>||银行对账单<br>||纳税申报表<br>||预算计划书<br>,4,参考解析：预算、计划、制度等文件材料，应当执行文书档案管理规定，不属于会计档案。<br>,会计法律制度,
220202007,关于会计档案的移交，表述错误的是{{c1::}}。,纸质会计档案移交时应当保持原卷的封装<br>||电子会计档案移交时应当将电子会计档案及其元数据一并移交，且文件格式应当符合国家档案管理的有关规定<br>||特殊格式的电子会计档案应当与其读取平台一并移交<br>||单位会计管理机构在办理会计档案移交时，应当编制会计档案移交清册，不需要办理移交手续<br>,4,参考解析：单位会计管理机构在办理会计档案移交时，应当编制会计档案移交清册，并按照国家档案管理的有关规定办理移交手续。<br>,会计法律制度,
220202008,下列关于会计档案保管期限，说法正确的是{{c1::}}。,单位会计管理机构临时保管会计档案最长不超过3年<br>||会计档案保管期限从单位会计管理机构向档案管理机构移交会计档案之日起开始计算<br>||会计档案保管期限分为不定期与定期两类<br>||企业固定资产卡片的保管期限，应自卡片建立起5年<br>,1,参考解析：根据规定，会计档案的保管期限是从会计年度终了后的第一天算起，因此选项B的说法错误；会计档案保管期限分为永久与定期两类，因此选项C的说法错误；企业固定资产卡片的保管期限，应自固定资产报废清理后5年，因此选项D的说法错误。<br>,会计法律制度,
