id,question,options,answer,notes,Tags,questionPre
220202058,会计机构负责人办理交接手续，应由主管单位派人进行监交。{{c1::}},对<br>||错<br>,2,参考解析： 会计机构负责人办理交接手续时，由单位领导人负责监交，必要时，主管单位可以派人会同监交。<br>,会计法律制度,
220202059,会计工作交接后，原移交人员因会计资料已办理移交，因而不再对这些会计资料的合法性、真实性负责。{{c1::}},对<br>||错<br>,2,参考解析： 移交人员应当对所移交的会计资料的合法性、真实性负责。<br>,会计法律制度,
220202060,注册会计师实施审计程序中，在获取充分、适当的审计证据后，如果认为错报单独或汇总起来对财务报表的影响重大且具有广泛性，注册会计师应当发表否定意见类型的审计报告。{{c1::}},对<br>||错<br>,1,参考解析：<br>,会计法律制度,
220202061,张某具备博士学位，2021年取得了会计师职称，张某若要符合担任正高级会计师的工作年限要求，应从事与会计师职责相关工作满5年。{{c1::}},对<br>||错<br>,2,参考解析：担任正高级会计师，—般应具有大学本科及以上学历或学士以上学位，取得“高级会计师职称后”，从事与“高级会计师”职责相关工作满5年。<br>,会计法律制度,
220202062,代理记账机构应当于每年4月30日之前，向审批机关报送代理记账机构基本情况表和专职从业人员变动情况。设立分支机构的，由总机构报送，分支机构不用单独报送。{{c1::}},对<br>||错<br>,2,参考解析：代理记账机构设立分支机构的，分支机构应当于每年4月30日之前向其所在地的审批机关报送相关材料。<br>,会计法律制度,
220202063,在必要情况下，收到检举材料和处理检举的相关部门及人员可以将被检举人姓名和检举材料转给被检举单位。{{c1::}},对<br>||错<br>,2,参考解析：任何单位和个人对违反《会计法》和国家统一的会计制度的行为，都有权进行检举。为保护检举人的合法权益，收到检举材料和处理检举的部门及其相关人员应当为检举人保密，不得将检举人姓名和检举材料转给被检举单位和被检举个人。转交的，尚未构成犯罪的，应被给予行政处分。<br>,会计法律制度,
220202064,因故意销毁会计凭证被依法追究刑事责任的会计人员，不得再从事会计工作。{{c1::}},对<br>||错<br>,1,参考解析：<br>,会计法律制度,
220203001,根据支付结算法律制度的规定，下列关于票据填写要求的表述中，不正确的是{{c1::}}。,单位名称应当记载全称或者规范化简称<br>||个人在票据和结算凭证上的签章，应为该个人本人的签名或盖章<br>||出票日期可选择使用中文大写或阿拉伯数字<br>||金额以中文大写和阿拉伯数字同时记载，二者必须一致<br>,3,参考解析：根据规定，票据的出票日期必须使用中文大写，不可以使用阿拉伯数字。<br>,支付结算法律制度,
220203002,甲公司因长期经营不善被宣告破产，撤销在银行开立的结算账户时，其应当最后撤销的是{{c1::}}。,临时存款账户<br>||专用存款账户<br>||一般存款账户<br>||基本存款账户<br>,4,参考解析：撤销银行结算账户时，应先撤销一般存款账户、专用存款账户、临时存款账户，将账户资金转入基本存款账户后，方可办理基本存款账户的撤销。<br>,支付结算法律制度,
220203003,根据支付结算法律制度的规定，下列首次申请开立单位银行结算账户的存款人中，不应开立基本存款账户的是{{c1::}}。,甲学校<br>||乙电影公司临时摄制组<br>||丙境外机构<br>||丁有限责任公司<br>,2,参考解析：选项B，临时机构不得开立基本存款账户，可以申请开立临时存款账户。<br>,支付结算法律制度,
220203004,下列有关基本存款账户的说法中，错误的是{{c1::}}。,单位设立的独立核算的附属机构不得申请开立基本存款账户<br>||居民委员会、村民委员会、社区委员会均可以申请开立基本存款账户<br>||基本存款账户是存款人因办理日常转账结算和现金收付需要开立的银行结算账户<br>||企业法人开立基本存款账户的，应出具企业法人营业执照<br>,1,参考解析： 选项A，单位设立的独立核算的附属机构可以申请开立基本存款账户。<br>,支付结算法律制度,
220203005,根据支付结算法律制度的规定，下列关于预算单位零余额账户的使用，说法正确的是{{c1::}}。,不得支取现金<br>||可以向所属下级单位账户划拨资金<br>||可以向上级主管单位账户划拨资金<br>||可以向本单位按账户管理规定保留的相应账户划拨工会经费<br>,4,参考解析： 选项A，预算单位零余额账户可以办理“转账”“提取现金”等结算业务；选项B和选项C，预算单位零余额账户不得违反规定向“本单位其他账户”和“上级主管单位”“所属下级单位账户”划拨资金；选项D，预算单位零余额账户可以向本单位按账户管理规定保留的相应账户划拨工会经费、住房公积金及提租补贴，以及财政部门批准的特殊款项。<br>,支付结算法律制度,
220203006,甲公司通过网银向个人分散、高频且跨区域支付劳务款项，被开户银行认定为可疑交易，银行的下列处理措施中，错误的是{{c1::}}。,应关闭甲公司单位银行结算账户的网上银行转账功能<br>||甲公司未提供相关付款依据的，银行应拒绝办理转账业务<br>||要求存款人到银行网点柜台办理转账业务，并出具书面付款依据或相关证明文件<br>||应冻结甲公司单位银行结算账户的全部资金<br>,4,参考解析： 单位向个人付款时，应对应对款项事由的真实性、合法性负责。若出现可疑交易，银行应关闭单位银行结算账户的网上银行转账功能，要求存款人到银行网点柜台办理转账业务，并出具书面付款依据或相关证明文件。如存款人未提供相关依据或相关依据不符合规定的，银行应拒绝办理转账业务。<br>,支付结算法律制度,
220203007,根据支付结算法律制度的规定，下列关于票据付款人的表述中正确的是{{c1::}}。,支票的付款人是出票人<br>||商业承兑汇票的付款人是承兑人<br>||银行汇票的付款人是申请人<br>||银行承兑汇票的付款人是出票人<br>,2,参考解析：选项A，支票的出票人，为在银行开立支票存款账户的企业、其他组织和个人，支票的付款人是出票人的开户银行；选项C，银行汇票的付款人是出票银行；选项D，银行承兑汇票的付款人是承兑银行。<br>,支付结算法律制度,
220203008,甲公司持有一张商业汇票，到期委托开户银行向承兑人收取票款。甲公司行使的票据权利是{{c1::}}。,付款请求权<br>||利益返还请求权<br>||票据追索权<br>||票据返还请求权<br>,1,参考解析： 付款请求权，是指持票人向汇票的承兑人、本票的出票人、支票的付款人出示票据要求付款的权利，是第一顺序权利。<br>,支付结算法律制度,
220203009,甲公司受乙公司欺诈而向其签发一张汇票，乙公司为支付货款将该汇票背书给不知情的丙公司，丙公司被丁公司吸收合并，丁公司为支付工程款，将该汇票背书给善意并支付合理对价的戊公司。下列取得汇票的主体中，不享有票据权利的是{{c1::}}。,丙公司<br>||丁公司<br>||乙公司<br>||戊公司<br>,3,参考解析：持票人以欺诈、偷盗或者胁迫等手段取得票据的，或者明知有上述情形，出于恶意取得票据的，不享有票据权利。本题中，乙公司是因欺诈取得的票据，其不享有票据权利。乙公司将其背书给丙公司，因丙公司善意无过失，且支付了对价，因此丙公司享有票据权利；丁公司通过吸收合并方式获得该项票据权利；戊公司通过支付对价方式获得票据权利。<br>,支付结算法律制度,
220203010,根据支付结算法律制度的规定，票据凭证不能满足背书人记载事项的需要，可以加附粘单。粘单上的第一记载人，应当在票据和粘单的粘接处签章。该记载人是{{c1::}}。,粘单上第一手背书的被背书人<br>||粘单上最后一手背书的背书人<br>||粘单上第一手背书的背书人<br>||票据持票人<br>,3,参考解析：背书人是指在转让票据时，在票据背面或粘单上签字或盖章，并将该票据交付给受让人的票据收款人或持有人。粘单上的第一记载人，为粘单上第一手背书的背书人，应当在票据和粘单的粘接处签章。<br>,支付结算法律制度,
220203011,根据票据法律制度的规定，付款人承兑时如附有条件，下列说法正确的是{{c1::}}。,所附条件不具有汇票上的效力<br>||所附条件满足，承兑方能成立<br>||所附条件满足，承兑人应当承担到期付款的责任<br>||视为拒绝承兑<br>,4,参考解析： 根据规定，付款人承兑汇票，不得附有条件；承兑附有条件的，视为拒绝承兑。<br>,支付结算法律制度,
220203012,根据支付结算法律制度的规定，下列关于票据追索权行使的表述中，正确的是{{c1::}}。,持票人在行使追索权时，不必提供被拒绝承兑或拒绝付款的有关证明<br>||持票人不得在票据到期前追索<br>||持票人未按照规定期限将被拒绝付款的事由书面通知前手的，丧失追索权<br>||持票人可以不按照票据的承兑人、背书人、保证人和出票人的顺序行使追索权<br>,4,参考解析：选项A，持票人行使追索权时，应当提供被拒绝承兑或者拒绝付款的有关证明；选项B，到期前追索，是指票据到期日前，持票人对下列情形之一行使的追索：①汇票被拒绝承兑的；②承兑人或者付款人死亡、逃匿的；③承兑人或者付款人被依法宣告破产的或者因违法被责令终止业务活动的；选项C，未按照规定期限通知的，持票人仍可以行使追索权。因延期通知给其前手或者出票人造成损失的，由没有按照规定期限通知的票据当事人，承担对该损失的赔偿责任。<br>,支付结算法律制度,
220203013,根据支付结算法律制度的规定，下列关于银行承兑汇票付款责任的表述中，不正确的是{{c1::}}。,承兑银行无抗辩事由的，应在汇票到期日或到期日后的见票当日支付票款<br>||出票人应于汇票到期前将票款足额交存开户银行<br>||承兑银行存在抗辩事由拒绝支付的，应出具拒绝付款证明<br>||汇票到期日出票人未足额交存票款的，承兑银行付款后应按票面金额计收利息<br>,4,参考解析：选项D，银行承兑汇票的出票人于汇票到期日未能足额交存票款时，承兑银行除凭票向持票人无条件付款外，对出票人“尚未支付的汇票金额”按照每天万分之五计收利息。<br>,支付结算法律制度,
220203014,A公司签发一张银行承兑汇票给B公司，C银行对该汇票进行承兑。D公司为该汇票保证，并注明“B公司不得背书转让”，但未记载被保证人名称和保证日期。后B公司为支付货款将该汇票背书转让给E公司。根据规定，下列关于该汇票，说法正确的是{{c1::}}。,D公司的保证附有条件，视为拒绝保证<br>||A公司为被保证人<br>||D公司对B公司的后手被背书人E公司不承担保证责任<br>||未记载保证日期，出票日期为保证日期<br>,4,参考解析：根据规定，保证不得附有条件，保证附有条件的，所附条件无效，但不影响保证的效力，因此选项A与选项C的说法错误；在票据上未记载“被保证人名称”的，已承兑的票据，承兑人为被保证人；未承兑的票据，出票人为被保证人，因此选项B的说法错误。未记载“保证日期”的，出票日期为保证日期。<br>,支付结算法律制度,
220203015,甲公司当年8月5日向乙公司签发了一张见票后3个月付款的银行承兑汇票，根据票据法律制度的规定，乙公司应于规定时间前向付款人提示承兑。该时间为{{c1::}}。,9月5日<br>||9月15日<br>||10月5日<br>||11月15日<br>,1,参考解析：见票后定期付款的汇票，持票人应当自出票之日起1个月内向付款人提示承兑。<br>,支付结算法律制度,
220203016,甲公司从异地乙公司购进中药材一批，于2021年4月20日开出了10万元的见票后3个月付款的银行承兑汇票支付该笔货款，乙公司于4月28日提示承兑，则乙公司提示付款的最后期限为{{c1::}}。,2021年5月20日<br>||2021年6月20日<br>||2021年7月30日<br>||2021年8月6日<br>,4,参考解析：该商业汇票在4月28日提示承兑，即4月28日见票，则该票据到期日为2021年7月28日。根据《中华人民共和国票据法》规定，见票后定期付款的商业汇票，自到期日起10天内向承兑人提示付款。则乙公司提示付款的最后期限为2021年8月6日。<br>,支付结算法律制度,
220203017,根据票据法律制度的规定，下列对银行汇票的表述中，不正确的是{{c1::}}。,未填明实际结算金额和多余金额或者实际结算金额超过出票金额的银行汇票，银行不予受理<br>||更改实际结算金额的银行汇票无效<br>||银行汇票的背书转让以出票金额为准<br>||未填写实际结算金额或者实际结算金额超过出票金额的银行汇票不得背书转让<br>,3,参考解析： 银行汇票的背书转让以不超过出票金额的实际结算金额为准。<br>,支付结算法律制度,
220203018,根据支付结算法律制度的规定，关于银行本票使用的下列表述中，不正确的是{{c1::}}。,银行本票的出票人在持票人提示见票时，必须承担付款责任<br>||注明“现金”字样的银行本票可以用于支取现金<br>||银行本票只限于单位使用，个人不得使用<br>||收款人可以将银行本票背书转让给被背书人<br>,3,参考解析：选项C，“单位和个人”在同一票据交换区域需要支付各种款项，均可以使用银行本票。<br>,支付结算法律制度,
220203019,根据支付结算法律制度的规定，下列各项关于支票提示付款的说法中，正确的是{{c1::}}。,转账支票提示付款期限为出票日起1个月<br>||出票人记载自己为收款人的，提示付款不予受理<br>||支票未记载收款人名称，可以提示付款<br>||现金支票仅限于收款人向付款人提示付款<br>,4,参考解析：选项A，支票的提示付款期限为出票日起10日；选项B，支票出票人可以记载自己为收款人；选项C，支票的金额、收款人名称，可以由出票人授权补记，未补记前不得背书转让和提示付款；现金支票只能支取现金，不得背书转让，因此仅限于收款人向付款人提示付款。<br>,支付结算法律制度,
220203020,下列有关票据贴现的说法中，正确的是{{c1::}}。,商业汇票、银行汇票、本票和支票均可以申请贴现<br>||出票人在票据上记载“不得转让”字样的，该票据不得贴现<br>||实付贴现金额按票面金额扣除贴现日至汇票到期日止的利息计算<br>||贴现的期限为从其贴现之日至汇票到期前1日<br>,2,参考解析： 只有商业汇票才涉及贴现的问题，银行汇票、本票和支票是见票即付的票据，不用贴现，选项A的表述错误。贴现的期限从其贴现之日起至汇票到期日止，选项D的说法错误；实付贴现金额按票面金额扣除贴现日至汇票到期前1日的利息计算。承兑人在异地的纸质商业汇票，贴现的期限以及贴现利息的计算应另加3天的划款日期，选项C的说法错误。<br>,支付结算法律制度,
220203021,2021年12月13日，乙公司持一张汇票向承兑银行P银行提示付款，该汇票出票人为甲公司，金额为100万元，到期日为2021年12月12日。已知12月13日，甲公司账户余额为10万元。后又于12月18日存入100万元。P银行拟对该汇票采取的下列处理方式中，正确的是{{c1::}}。,于12月18日向乙公司付款100万元<br>||于12月13日拒绝付款，退回汇票<br>||于12月13日向乙公司付款100万元<br>||于12月13日向乙公司付款10万元<br>,3,参考解析： 银行承兑汇票的出票人于汇票到期日未能足额交存票款时，承兑银行除凭票向持票人无条件付款外，对出票人尚未支付的汇票金额按照每天万分之五计收利息。<br>,支付结算法律制度,
220203022,根据支付结算法律制度的规定，下列结算方式中，仅适用于单位之间款项结算的是{{c1::}}。,电汇<br>||信汇<br>||商业汇票<br>||委托收款<br>,3,参考解析： 选项ABD所表述的结算工具，单位和个人均可使用。<br>,支付结算法律制度,
220203023,根据支付结算法律制度的规定，下列关于银行卡分类的表述中，不正确的是{{c1::}}。,按是否具有透支功能分为信用卡和贷记卡<br>||按币种不同分为外币卡和人民币卡<br>||按发行对象分为单位卡和个人卡<br>||按信息载体分为磁条卡和芯片卡<br>,1,参考解析：选项A，银行卡按照是否透支分为信用卡和借记卡，信用卡按是否向发卡银行交存备用金分为贷记卡、准贷记卡两类。<br>,支付结算法律制度,
220203024,根据支付结算法律制度的规定，关于预付卡使用的下列表述中，正确的是{{c1::}}。,可在发卡机构签约的特约商户中使用<br>||可向银行账户转移卡内资金<br>||可用于提取现金<br>||可用于购买非本发卡机构发行的预付卡<br>,1,参考解析： 选项BCD，预付卡在发卡机构拓展、签约的特约商户中使用，不得用于或变相用于提取现金，不得用于购买、交换非本发卡机构发行的预付卡、单一行业卡及其他商业预付卡或向其充值，卡内资金不得向银行账户或向非本发卡机构开立的网络支付账户转移。<br>,支付结算法律制度,
220203025,根据支付结算法律制度的规定，下列关于预付卡期限的说法中，正确的是{{c1::}}。,记名预付卡可设置3个月有效期<br>||不记名预付卡有效期应为固定的3年期限<br>||不记名预付卡卡面记载有效期限或有效期截止日<br>||超过有效期的预付卡，一律作废不得使用<br>,3,参考解析：根据规定，记名预付卡可挂失、可赎回、不得设置有效期，因此选项A的说法错误；不记名预付卡有效期不得低于3年，因此选项B的说法错误；超过有效期尚有资金余额的预付卡，可通过延期、激活、换卡等方式继续使用，因此选项D的说法错误。<br>,支付结算法律制度,
220203026,根据支付结算法律制度的规定，下列情形中，属于条码支付的是{{c1::}}。,张某办理健身会员，商家用手持终端机扫描张某出示的手机付款码收款<br>||王某在某APP平台购物线上付款后，到线下便利店自提商品<br>||李某在加油站加油，通过POS机刷信用卡支付加油款<br>||赵某双十一网上购物，通过支付宝担保方式支付货款<br>,1,参考解析：条码支付业务包括付款扫码和收款扫码。付款扫码是指付款人通过移动终端识读收款人展示的条码完成支付的行为。收款扫码是指收款人通过识读付款人移动终端展示的条码完成支付的行为。本题选项A表述属于收款扫码。<br>,支付结算法律制度,
220203027,根据支付结算法律制度的规定，下列关于网上银行的表述中，正确的是{{c1::}}。,企业网上银行主要适用于企业单位，事业单位不适用<br>||纯网上银行是只有一个站点的银行<br>||B2C指的是企业与企业之间进行的电子商务活动<br>||企业网上银行子系统的功能包括银证转账业务<br>,2,参考解析： 选项A，根据规定，企业网上银行适用于企事业单位；选项C，B2B指的是企业与企业之间进行的电子商务活动；选项D，银证转账业务是个人网上子系统的业务功能。<br>,支付结算法律制度,
220203028,根据《支付结算办法》的规定，汇款人委托银行将其款项支付给收款人的结算方式是{{c1::}}。,汇兑<br>||国内信用证<br>||托收承付<br>||委托收款<br>,1,参考解析： 根据支付结算办法的规定，汇款人委托银行将其款项支付给收款人的结算方式为汇兑结算方式。<br>,支付结算法律制度,
220203029,甲公司委托乙银行向丙企业收取款项，丙企业开户银行在债务证明到期日办理划款时，发现丙企业存款账户不足支付，根据规定，开户行可以采取的行为是{{c1::}}。,直接向甲公司出具拒绝支付证明<br>||应通过乙银行向甲公司发出未付款通知书<br>||先按委托收款凭证及债务证明标明的金额向甲公司付款，然后向丙企业追索<br>||应通知丙企业存足相应款项，如果丙企业在规定的时间内未存足款项的，再向乙银行出具拒绝支付证明<br>,2,参考解析： 根据委托收款的有关规定，银行在办理划款时，发现付款人存款账户不足支付的，应通过被委托银行向收款人发出未付款通知书。<br>,支付结算法律制度,
220203030,网络支付机构采用非面对面方式开立个人开立账户时，应通过外部渠道进行多重交叉验证，下列情形中，能够开立Ⅲ类户的最少外部渠道数量是{{c1::}}。,通过六个合法安全的外部渠道<br>||通过三个合法安全的外部渠道<br>||通过五个合法安全的外部渠道<br>||通过一个合法安全的外部渠道<br>,3,参考解析：支付机构开立Ⅲ类户的，以面对面方式核实身份或以非面对面方式通过“至少五个”合法安全的外部渠道进行身份基本信息多重交叉验证。<br>,支付结算法律制度,
220203031,根据支付结算法律制度的规定，下列各项中，属于单位、个人在社会经济活动中使用的人民币非现金支付工具的有{{c1::}}。,股票<br>||支票<br>||汇票<br>||本票<br>,2||3||4,参考解析：非现金支付工具主要包括“三票一卡”和结算方式。“三票一卡”是指汇票、本票、支票和银行卡，结算方式包括汇兑、托收承付和委托收款等。<br>,支付结算法律制度,
220203032,根据支付结算法律制度的规定，下列关于支票出票的表述中，正确的有{{c1::}}。,出票人签发的支票金额不得超过其付款时在付款人处实有的存款金额<br>||出票人不得签发与其预留银行签章不符的支票<br>||支票上未记载付款行名称的，支票无效<br>||出票人不得在支票上记载自己为收款人<br>,1||2||3,参考解析：出票人可以在支票上记载自己为收款人。<br>,支付结算法律制度,
220203033,下列选项中，属于银行结算账户管理的基本内容有{{c1::}}。,实名制管理<br>||账户变更事项的管理<br>||存款人预留银行签章的管理<br>||对账管理<br>,1||2||3||4,参考解析：银行结算账户管理的基本内容包括五项：实名制管理、账户资金的管理、账户变更事项的管理、存款人预留银行签章的管理、银行结算账户的对账管理。<br>,支付结算法律制度,
220203034,根据个人银行账户实名制的要求，存款人申请开立个人银行结算账户时，应向银行出具本人有效证件。下列属于有效身份证件的有{{c1::}}。,中华人民共和国境内已登记常住户口的中国公民的居民身份证<br>||中国台湾地区居民的台湾居民来往大陆通行证<br>||国外中国公民的中国护照<br>||中国香港、澳门特别行政区居民的香港、澳门特别行政区居民身份证<br>,1||2||3,参考解析：选项D属于辅助身份证明材料。香港、澳门特别行政区居民的有效身份证件为港澳居民来往内地通行证、港澳居民居住证。<br>,支付结算法律制度,
220203035,张三拥有A银行所开立的I类账户、II类账户和III类账户各一个。下列关于张三使用个人银行结算账户办理业务的说法中，正确的有{{c1::}}。,张三可以通过II类账户和III类账户购买银行理财产品<br>||张三可以通过绑定账户向II类账户转账存入资金<br>||张三可以通过自助操作方式，从III类账户转出资金至非绑定账户，没有限额限制<br>||张三可以通过II类账户和III类账户网上购物消费<br>,2||4,参考解析：根据规定，III类账户不能购买理财产品，选项A错误；III类户可以办理限额消费和缴费、限额向非绑定账户转出资金业务。经银行柜面、自助设备加以银行工作人员现场面对面确认身份的，III类户还可以办理非绑定账户资金转入业务。其中，III类户账户余额不得超过2000元。<br>,支付结算法律制度,
